No.     Time           Source                Destination           Protocol Length Info
     45 7.262372       10.70.1.20            10.70.1.234           MQTT     94     Connect Command

Frame 45: 94 bytes on wire (752 bits), 94 bytes captured (752 bits) on interface 0
Ethernet II, Src: Giga-Byt_d1:2a:ce (90:2b:34:d1:2a:ce), Dst: Wibrain_30:18:81 (00:1e:06:30:18:81)
Internet Protocol Version 4, Src: 10.70.1.20, Dst: 10.70.1.234
Transmission Control Protocol, Src Port: 44882, Dst Port: 1883, Seq: 1, Ack: 1, Len: 40
MQ Telemetry Transport Protocol, Connect Command

No.     Time           Source                Destination           Protocol Length Info
     48 7.263334       10.70.1.234           10.70.1.20            MQTT     60     Connect Ack

Frame 48: 60 bytes on wire (480 bits), 60 bytes captured (480 bits) on interface 0
Ethernet II, Src: Wibrain_30:18:81 (00:1e:06:30:18:81), Dst: Giga-Byt_d1:2a:ce (90:2b:34:d1:2a:ce)
Internet Protocol Version 4, Src: 10.70.1.234, Dst: 10.70.1.20
Transmission Control Protocol, Src Port: 1883, Dst Port: 44882, Seq: 1, Ack: 41, Len: 4
MQ Telemetry Transport Protocol, Connect Ack

No.     Time           Source                Destination           Protocol Length Info
    109 28.192400      10.70.1.20            10.70.1.234           MQTT     87     Publish Message

Frame 109: 87 bytes on wire (696 bits), 87 bytes captured (696 bits) on interface 0
Ethernet II, Src: Giga-Byt_d1:2a:ce (90:2b:34:d1:2a:ce), Dst: Wibrain_30:18:81 (00:1e:06:30:18:81)
Internet Protocol Version 4, Src: 10.70.1.20, Dst: 10.70.1.234
Transmission Control Protocol, Src Port: 44882, Dst Port: 1883, Seq: 41, Ack: 5, Len: 33
MQ Telemetry Transport Protocol, Publish Message

No.     Time           Source                Destination           Protocol Length Info
    110 28.193399      10.70.1.234           10.70.1.20            MQTT     60     Publish Ack

Frame 110: 60 bytes on wire (480 bits), 60 bytes captured (480 bits) on interface 0
Ethernet II, Src: Wibrain_30:18:81 (00:1e:06:30:18:81), Dst: Giga-Byt_d1:2a:ce (90:2b:34:d1:2a:ce)
Internet Protocol Version 4, Src: 10.70.1.234, Dst: 10.70.1.20
Transmission Control Protocol, Src Port: 1883, Dst Port: 44882, Seq: 5, Ack: 74, Len: 4
MQ Telemetry Transport Protocol, Publish Ack

No.     Time           Source                Destination           Protocol Length Info
    113 28.193502      10.70.1.20            10.70.1.234           MQTT     122    Publish Message, Publish Message

Frame 113: 122 bytes on wire (976 bits), 122 bytes captured (976 bits) on interface 0
Ethernet II, Src: Giga-Byt_d1:2a:ce (90:2b:34:d1:2a:ce), Dst: Wibrain_30:18:81 (00:1e:06:30:18:81)
Internet Protocol Version 4, Src: 10.70.1.20, Dst: 10.70.1.234
Transmission Control Protocol, Src Port: 44882, Dst Port: 1883, Seq: 74, Ack: 9, Len: 68
MQ Telemetry Transport Protocol, Publish Message
MQ Telemetry Transport Protocol, Publish Message

No.     Time           Source                Destination           Protocol Length Info
    116 28.194353      10.70.1.234           10.70.1.20            MQTT     60     Publish Ack

Frame 116: 60 bytes on wire (480 bits), 60 bytes captured (480 bits) on interface 0
Ethernet II, Src: Wibrain_30:18:81 (00:1e:06:30:18:81), Dst: Giga-Byt_d1:2a:ce (90:2b:34:d1:2a:ce)
Internet Protocol Version 4, Src: 10.70.1.234, Dst: 10.70.1.20
Transmission Control Protocol, Src Port: 1883, Dst Port: 44882, Seq: 9, Ack: 142, Len: 4
MQ Telemetry Transport Protocol, Publish Ack

No.     Time           Source                Destination           Protocol Length Info
    134 28.235483      10.70.1.234           10.70.1.20            MQTT     60     Publish Ack

Frame 134: 60 bytes on wire (480 bits), 60 bytes captured (480 bits) on interface 0
Ethernet II, Src: Wibrain_30:18:81 (00:1e:06:30:18:81), Dst: Giga-Byt_d1:2a:ce (90:2b:34:d1:2a:ce)
Internet Protocol Version 4, Src: 10.70.1.234, Dst: 10.70.1.20
Transmission Control Protocol, Src Port: 1883, Dst Port: 44882, Seq: 13, Ack: 142, Len: 4
MQ Telemetry Transport Protocol, Publish Ack

No.     Time           Source                Destination           Protocol Length Info
    136 28.492567      10.70.1.20            10.70.1.234           MQTT     87     Publish Message

Frame 136: 87 bytes on wire (696 bits), 87 bytes captured (696 bits) on interface 0
Ethernet II, Src: Giga-Byt_d1:2a:ce (90:2b:34:d1:2a:ce), Dst: Wibrain_30:18:81 (00:1e:06:30:18:81)
Internet Protocol Version 4, Src: 10.70.1.20, Dst: 10.70.1.234
Transmission Control Protocol, Src Port: 44882, Dst Port: 1883, Seq: 142, Ack: 17, Len: 33
MQ Telemetry Transport Protocol, Publish Message

No.     Time           Source                Destination           Protocol Length Info
    138 28.493539      10.70.1.234           10.70.1.20            MQTT     60     Publish Ack

Frame 138: 60 bytes on wire (480 bits), 60 bytes captured (480 bits) on interface 0
Ethernet II, Src: Wibrain_30:18:81 (00:1e:06:30:18:81), Dst: Giga-Byt_d1:2a:ce (90:2b:34:d1:2a:ce)
Internet Protocol Version 4, Src: 10.70.1.234, Dst: 10.70.1.20
Transmission Control Protocol, Src Port: 1883, Dst Port: 44882, Seq: 17, Ack: 175, Len: 4
MQ Telemetry Transport Protocol, Publish Ack

No.     Time           Source                Destination           Protocol Length Info
    139 28.493629      10.70.1.20            10.70.1.234           MQTT     112    Publish Message, Publish Message

Frame 139: 112 bytes on wire (896 bits), 112 bytes captured (896 bits) on interface 0
Ethernet II, Src: Giga-Byt_d1:2a:ce (90:2b:34:d1:2a:ce), Dst: Wibrain_30:18:81 (00:1e:06:30:18:81)
Internet Protocol Version 4, Src: 10.70.1.20, Dst: 10.70.1.234
Transmission Control Protocol, Src Port: 44882, Dst Port: 1883, Seq: 175, Ack: 21, Len: 58
MQ Telemetry Transport Protocol, Publish Message
MQ Telemetry Transport Protocol, Publish Message

No.     Time           Source                Destination           Protocol Length Info
    143 28.494521      10.70.1.234           10.70.1.20            MQTT     60     Publish Ack

Frame 143: 60 bytes on wire (480 bits), 60 bytes captured (480 bits) on interface 0
Ethernet II, Src: Wibrain_30:18:81 (00:1e:06:30:18:81), Dst: Giga-Byt_d1:2a:ce (90:2b:34:d1:2a:ce)
Internet Protocol Version 4, Src: 10.70.1.234, Dst: 10.70.1.20
Transmission Control Protocol, Src Port: 1883, Dst Port: 44882, Seq: 21, Ack: 233, Len: 4
MQ Telemetry Transport Protocol, Publish Ack

No.     Time           Source                Destination           Protocol Length Info
    160 28.535045      10.70.1.234           10.70.1.20            MQTT     60     Publish Ack

Frame 160: 60 bytes on wire (480 bits), 60 bytes captured (480 bits) on interface 0
Ethernet II, Src: Wibrain_30:18:81 (00:1e:06:30:18:81), Dst: Giga-Byt_d1:2a:ce (90:2b:34:d1:2a:ce)
Internet Protocol Version 4, Src: 10.70.1.234, Dst: 10.70.1.20
Transmission Control Protocol, Src Port: 1883, Dst Port: 44882, Seq: 25, Ack: 233, Len: 4
MQ Telemetry Transport Protocol, Publish Ack

No.     Time           Source                Destination           Protocol Length Info
    164 29.993985      10.70.1.20            10.70.1.234           MQTT     87     Publish Message

Frame 164: 87 bytes on wire (696 bits), 87 bytes captured (696 bits) on interface 0
Ethernet II, Src: Giga-Byt_d1:2a:ce (90:2b:34:d1:2a:ce), Dst: Wibrain_30:18:81 (00:1e:06:30:18:81)
Internet Protocol Version 4, Src: 10.70.1.20, Dst: 10.70.1.234
Transmission Control Protocol, Src Port: 44882, Dst Port: 1883, Seq: 233, Ack: 29, Len: 33
MQ Telemetry Transport Protocol, Publish Message

No.     Time           Source                Destination           Protocol Length Info
    165 29.994871      10.70.1.234           10.70.1.20            MQTT     60     Publish Ack

Frame 165: 60 bytes on wire (480 bits), 60 bytes captured (480 bits) on interface 0
Ethernet II, Src: Wibrain_30:18:81 (00:1e:06:30:18:81), Dst: Giga-Byt_d1:2a:ce (90:2b:34:d1:2a:ce)
Internet Protocol Version 4, Src: 10.70.1.234, Dst: 10.70.1.20
Transmission Control Protocol, Src Port: 1883, Dst Port: 44882, Seq: 29, Ack: 266, Len: 4
MQ Telemetry Transport Protocol, Publish Ack

No.     Time           Source                Destination           Protocol Length Info
    167 29.994965      10.70.1.20            10.70.1.234           MQTT     122    Publish Message, Publish Message

Frame 167: 122 bytes on wire (976 bits), 122 bytes captured (976 bits) on interface 0
Ethernet II, Src: Giga-Byt_d1:2a:ce (90:2b:34:d1:2a:ce), Dst: Wibrain_30:18:81 (00:1e:06:30:18:81)
Internet Protocol Version 4, Src: 10.70.1.20, Dst: 10.70.1.234
Transmission Control Protocol, Src Port: 44882, Dst Port: 1883, Seq: 266, Ack: 33, Len: 68
MQ Telemetry Transport Protocol, Publish Message
MQ Telemetry Transport Protocol, Publish Message

No.     Time           Source                Destination           Protocol Length Info
    171 29.995754      10.70.1.234           10.70.1.20            MQTT     60     Publish Ack

Frame 171: 60 bytes on wire (480 bits), 60 bytes captured (480 bits) on interface 0
Ethernet II, Src: Wibrain_30:18:81 (00:1e:06:30:18:81), Dst: Giga-Byt_d1:2a:ce (90:2b:34:d1:2a:ce)
Internet Protocol Version 4, Src: 10.70.1.234, Dst: 10.70.1.20
Transmission Control Protocol, Src Port: 1883, Dst Port: 44882, Seq: 33, Ack: 334, Len: 4
MQ Telemetry Transport Protocol, Publish Ack

No.     Time           Source                Destination           Protocol Length Info
    188 30.036645      10.70.1.234           10.70.1.20            MQTT     60     Publish Ack

Frame 188: 60 bytes on wire (480 bits), 60 bytes captured (480 bits) on interface 0
Ethernet II, Src: Wibrain_30:18:81 (00:1e:06:30:18:81), Dst: Giga-Byt_d1:2a:ce (90:2b:34:d1:2a:ce)
Internet Protocol Version 4, Src: 10.70.1.234, Dst: 10.70.1.20
Transmission Control Protocol, Src Port: 1883, Dst Port: 44882, Seq: 37, Ack: 334, Len: 4
MQ Telemetry Transport Protocol, Publish Ack

No.     Time           Source                Destination           Protocol Length Info
    194 30.594454      10.70.1.20            10.70.1.234           MQTT     87     Publish Message

Frame 194: 87 bytes on wire (696 bits), 87 bytes captured (696 bits) on interface 0
Ethernet II, Src: Giga-Byt_d1:2a:ce (90:2b:34:d1:2a:ce), Dst: Wibrain_30:18:81 (00:1e:06:30:18:81)
Internet Protocol Version 4, Src: 10.70.1.20, Dst: 10.70.1.234
Transmission Control Protocol, Src Port: 44882, Dst Port: 1883, Seq: 334, Ack: 41, Len: 33
MQ Telemetry Transport Protocol, Publish Message

No.     Time           Source                Destination           Protocol Length Info
    195 30.595252      10.70.1.234           10.70.1.20            MQTT     60     Publish Ack

Frame 195: 60 bytes on wire (480 bits), 60 bytes captured (480 bits) on interface 0
Ethernet II, Src: Wibrain_30:18:81 (00:1e:06:30:18:81), Dst: Giga-Byt_d1:2a:ce (90:2b:34:d1:2a:ce)
Internet Protocol Version 4, Src: 10.70.1.234, Dst: 10.70.1.20
Transmission Control Protocol, Src Port: 1883, Dst Port: 44882, Seq: 41, Ack: 367, Len: 4
MQ Telemetry Transport Protocol, Publish Ack

No.     Time           Source                Destination           Protocol Length Info
    203 30.702995      10.70.1.20            10.70.1.234           MQTT     88     Publish Message

Frame 203: 88 bytes on wire (704 bits), 88 bytes captured (704 bits) on interface 0
Ethernet II, Src: Giga-Byt_d1:2a:ce (90:2b:34:d1:2a:ce), Dst: Wibrain_30:18:81 (00:1e:06:30:18:81)
Internet Protocol Version 4, Src: 10.70.1.20, Dst: 10.70.1.234
Transmission Control Protocol, Src Port: 44882, Dst Port: 1883, Seq: 367, Ack: 45, Len: 34
MQ Telemetry Transport Protocol, Publish Message

No.     Time           Source                Destination           Protocol Length Info
    204 30.703786      10.70.1.234           10.70.1.20            MQTT     60     Publish Ack

Frame 204: 60 bytes on wire (480 bits), 60 bytes captured (480 bits) on interface 0
Ethernet II, Src: Wibrain_30:18:81 (00:1e:06:30:18:81), Dst: Giga-Byt_d1:2a:ce (90:2b:34:d1:2a:ce)
Internet Protocol Version 4, Src: 10.70.1.234, Dst: 10.70.1.20
Transmission Control Protocol, Src Port: 1883, Dst Port: 44882, Seq: 45, Ack: 401, Len: 4
MQ Telemetry Transport Protocol, Publish Ack

No.     Time           Source                Destination           Protocol Length Info
    206 30.703885      10.70.1.20            10.70.1.234           MQTT     78     Publish Message

Frame 206: 78 bytes on wire (624 bits), 78 bytes captured (624 bits) on interface 0
Ethernet II, Src: Giga-Byt_d1:2a:ce (90:2b:34:d1:2a:ce), Dst: Wibrain_30:18:81 (00:1e:06:30:18:81)
Internet Protocol Version 4, Src: 10.70.1.20, Dst: 10.70.1.234
Transmission Control Protocol, Src Port: 44882, Dst Port: 1883, Seq: 401, Ack: 49, Len: 24
MQ Telemetry Transport Protocol, Publish Message

No.     Time           Source                Destination           Protocol Length Info
    210 30.704751      10.70.1.234           10.70.1.20            MQTT     60     Publish Ack

Frame 210: 60 bytes on wire (480 bits), 60 bytes captured (480 bits) on interface 0
Ethernet II, Src: Wibrain_30:18:81 (00:1e:06:30:18:81), Dst: Giga-Byt_d1:2a:ce (90:2b:34:d1:2a:ce)
Internet Protocol Version 4, Src: 10.70.1.234, Dst: 10.70.1.20
Transmission Control Protocol, Src Port: 1883, Dst Port: 44882, Seq: 49, Ack: 425, Len: 4
MQ Telemetry Transport Protocol, Publish Ack

No.     Time           Source                Destination           Protocol Length Info
    223 32.203801      10.70.1.20            10.70.1.234           MQTT     87     Publish Message

Frame 223: 87 bytes on wire (696 bits), 87 bytes captured (696 bits) on interface 0
Ethernet II, Src: Giga-Byt_d1:2a:ce (90:2b:34:d1:2a:ce), Dst: Wibrain_30:18:81 (00:1e:06:30:18:81)
Internet Protocol Version 4, Src: 10.70.1.20, Dst: 10.70.1.234
Transmission Control Protocol, Src Port: 44882, Dst Port: 1883, Seq: 425, Ack: 53, Len: 33
MQ Telemetry Transport Protocol, Publish Message

No.     Time           Source                Destination           Protocol Length Info
    224 32.204675      10.70.1.234           10.70.1.20            MQTT     60     Publish Ack

Frame 224: 60 bytes on wire (480 bits), 60 bytes captured (480 bits) on interface 0
Ethernet II, Src: Wibrain_30:18:81 (00:1e:06:30:18:81), Dst: Giga-Byt_d1:2a:ce (90:2b:34:d1:2a:ce)
Internet Protocol Version 4, Src: 10.70.1.234, Dst: 10.70.1.20
Transmission Control Protocol, Src Port: 1883, Dst Port: 44882, Seq: 53, Ack: 458, Len: 4
MQ Telemetry Transport Protocol, Publish Ack

No.     Time           Source                Destination           Protocol Length Info
    226 32.204776      10.70.1.20            10.70.1.234           MQTT     122    Publish Message, Publish Message

Frame 226: 122 bytes on wire (976 bits), 122 bytes captured (976 bits) on interface 0
Ethernet II, Src: Giga-Byt_d1:2a:ce (90:2b:34:d1:2a:ce), Dst: Wibrain_30:18:81 (00:1e:06:30:18:81)
Internet Protocol Version 4, Src: 10.70.1.20, Dst: 10.70.1.234
Transmission Control Protocol, Src Port: 44882, Dst Port: 1883, Seq: 458, Ack: 57, Len: 68
MQ Telemetry Transport Protocol, Publish Message
MQ Telemetry Transport Protocol, Publish Message

No.     Time           Source                Destination           Protocol Length Info
    230 32.205619      10.70.1.234           10.70.1.20            MQTT     60     Publish Ack

Frame 230: 60 bytes on wire (480 bits), 60 bytes captured (480 bits) on interface 0
Ethernet II, Src: Wibrain_30:18:81 (00:1e:06:30:18:81), Dst: Giga-Byt_d1:2a:ce (90:2b:34:d1:2a:ce)
Internet Protocol Version 4, Src: 10.70.1.234, Dst: 10.70.1.20
Transmission Control Protocol, Src Port: 1883, Dst Port: 44882, Seq: 57, Ack: 526, Len: 4
MQ Telemetry Transport Protocol, Publish Ack

No.     Time           Source                Destination           Protocol Length Info
    246 32.246482      10.70.1.234           10.70.1.20            MQTT     60     Publish Ack

Frame 246: 60 bytes on wire (480 bits), 60 bytes captured (480 bits) on interface 0
Ethernet II, Src: Wibrain_30:18:81 (00:1e:06:30:18:81), Dst: Giga-Byt_d1:2a:ce (90:2b:34:d1:2a:ce)
Internet Protocol Version 4, Src: 10.70.1.234, Dst: 10.70.1.20
Transmission Control Protocol, Src Port: 1883, Dst Port: 44882, Seq: 61, Ack: 526, Len: 4
MQ Telemetry Transport Protocol, Publish Ack

No.     Time           Source                Destination           Protocol Length Info
    248 32.503926      10.70.1.20            10.70.1.234           MQTT     87     Publish Message

Frame 248: 87 bytes on wire (696 bits), 87 bytes captured (696 bits) on interface 0
Ethernet II, Src: Giga-Byt_d1:2a:ce (90:2b:34:d1:2a:ce), Dst: Wibrain_30:18:81 (00:1e:06:30:18:81)
Internet Protocol Version 4, Src: 10.70.1.20, Dst: 10.70.1.234
Transmission Control Protocol, Src Port: 44882, Dst Port: 1883, Seq: 526, Ack: 65, Len: 33
MQ Telemetry Transport Protocol, Publish Message

No.     Time           Source                Destination           Protocol Length Info
    249 32.504744      10.70.1.234           10.70.1.20            MQTT     60     Publish Ack

Frame 249: 60 bytes on wire (480 bits), 60 bytes captured (480 bits) on interface 0
Ethernet II, Src: Wibrain_30:18:81 (00:1e:06:30:18:81), Dst: Giga-Byt_d1:2a:ce (90:2b:34:d1:2a:ce)
Internet Protocol Version 4, Src: 10.70.1.234, Dst: 10.70.1.20
Transmission Control Protocol, Src Port: 1883, Dst Port: 44882, Seq: 65, Ack: 559, Len: 4
MQ Telemetry Transport Protocol, Publish Ack

No.     Time           Source                Destination           Protocol Length Info
    251 32.504806      10.70.1.20            10.70.1.234           MQTT     112    Publish Message, Publish Message

Frame 251: 112 bytes on wire (896 bits), 112 bytes captured (896 bits) on interface 0
Ethernet II, Src: Giga-Byt_d1:2a:ce (90:2b:34:d1:2a:ce), Dst: Wibrain_30:18:81 (00:1e:06:30:18:81)
Internet Protocol Version 4, Src: 10.70.1.20, Dst: 10.70.1.234
Transmission Control Protocol, Src Port: 44882, Dst Port: 1883, Seq: 559, Ack: 69, Len: 58
MQ Telemetry Transport Protocol, Publish Message
MQ Telemetry Transport Protocol, Publish Message

No.     Time           Source                Destination           Protocol Length Info
    255 32.505639      10.70.1.234           10.70.1.20            MQTT     60     Publish Ack

Frame 255: 60 bytes on wire (480 bits), 60 bytes captured (480 bits) on interface 0
Ethernet II, Src: Wibrain_30:18:81 (00:1e:06:30:18:81), Dst: Giga-Byt_d1:2a:ce (90:2b:34:d1:2a:ce)
Internet Protocol Version 4, Src: 10.70.1.234, Dst: 10.70.1.20
Transmission Control Protocol, Src Port: 1883, Dst Port: 44882, Seq: 69, Ack: 617, Len: 4
MQ Telemetry Transport Protocol, Publish Ack

No.     Time           Source                Destination           Protocol Length Info
    271 32.546191      10.70.1.234           10.70.1.20            MQTT     60     Publish Ack

Frame 271: 60 bytes on wire (480 bits), 60 bytes captured (480 bits) on interface 0
Ethernet II, Src: Wibrain_30:18:81 (00:1e:06:30:18:81), Dst: Giga-Byt_d1:2a:ce (90:2b:34:d1:2a:ce)
Internet Protocol Version 4, Src: 10.70.1.234, Dst: 10.70.1.20
Transmission Control Protocol, Src Port: 1883, Dst Port: 44882, Seq: 73, Ack: 617, Len: 4
MQ Telemetry Transport Protocol, Publish Ack

No.     Time           Source                Destination           Protocol Length Info
    276 34.006402      10.70.1.20            10.70.1.234           MQTT     87     Publish Message

Frame 276: 87 bytes on wire (696 bits), 87 bytes captured (696 bits) on interface 0
Ethernet II, Src: Giga-Byt_d1:2a:ce (90:2b:34:d1:2a:ce), Dst: Wibrain_30:18:81 (00:1e:06:30:18:81)
Internet Protocol Version 4, Src: 10.70.1.20, Dst: 10.70.1.234
Transmission Control Protocol, Src Port: 44882, Dst Port: 1883, Seq: 617, Ack: 77, Len: 33
MQ Telemetry Transport Protocol, Publish Message

No.     Time           Source                Destination           Protocol Length Info
    277 34.007255      10.70.1.234           10.70.1.20            MQTT     60     Publish Ack

Frame 277: 60 bytes on wire (480 bits), 60 bytes captured (480 bits) on interface 0
Ethernet II, Src: Wibrain_30:18:81 (00:1e:06:30:18:81), Dst: Giga-Byt_d1:2a:ce (90:2b:34:d1:2a:ce)
Internet Protocol Version 4, Src: 10.70.1.234, Dst: 10.70.1.20
Transmission Control Protocol, Src Port: 1883, Dst Port: 44882, Seq: 77, Ack: 650, Len: 4
MQ Telemetry Transport Protocol, Publish Ack

No.     Time           Source                Destination           Protocol Length Info
    279 34.007306      10.70.1.20            10.70.1.234           MQTT     88     Publish Message

Frame 279: 88 bytes on wire (704 bits), 88 bytes captured (704 bits) on interface 0
Ethernet II, Src: Giga-Byt_d1:2a:ce (90:2b:34:d1:2a:ce), Dst: Wibrain_30:18:81 (00:1e:06:30:18:81)
Internet Protocol Version 4, Src: 10.70.1.20, Dst: 10.70.1.234
Transmission Control Protocol, Src Port: 44882, Dst Port: 1883, Seq: 650, Ack: 81, Len: 34
MQ Telemetry Transport Protocol, Publish Message

No.     Time           Source                Destination           Protocol Length Info
    286 34.008110      10.70.1.234           10.70.1.20            MQTT     60     Publish Ack

Frame 286: 60 bytes on wire (480 bits), 60 bytes captured (480 bits) on interface 0
Ethernet II, Src: Wibrain_30:18:81 (00:1e:06:30:18:81), Dst: Giga-Byt_d1:2a:ce (90:2b:34:d1:2a:ce)
Internet Protocol Version 4, Src: 10.70.1.234, Dst: 10.70.1.20
Transmission Control Protocol, Src Port: 1883, Dst Port: 44882, Seq: 81, Ack: 684, Len: 4
MQ Telemetry Transport Protocol, Publish Ack

No.     Time           Source                Destination           Protocol Length Info
    295 34.108374      10.70.1.20            10.70.1.234           MQTT     88     Publish Message

Frame 295: 88 bytes on wire (704 bits), 88 bytes captured (704 bits) on interface 0
Ethernet II, Src: Giga-Byt_d1:2a:ce (90:2b:34:d1:2a:ce), Dst: Wibrain_30:18:81 (00:1e:06:30:18:81)
Internet Protocol Version 4, Src: 10.70.1.20, Dst: 10.70.1.234
Transmission Control Protocol, Src Port: 44882, Dst Port: 1883, Seq: 684, Ack: 85, Len: 34
MQ Telemetry Transport Protocol, Publish Message

No.     Time           Source                Destination           Protocol Length Info
    296 34.109213      10.70.1.234           10.70.1.20            MQTT     60     Publish Ack

Frame 296: 60 bytes on wire (480 bits), 60 bytes captured (480 bits) on interface 0
Ethernet II, Src: Wibrain_30:18:81 (00:1e:06:30:18:81), Dst: Giga-Byt_d1:2a:ce (90:2b:34:d1:2a:ce)
Internet Protocol Version 4, Src: 10.70.1.234, Dst: 10.70.1.20
Transmission Control Protocol, Src Port: 1883, Dst Port: 44882, Seq: 85, Ack: 718, Len: 4
MQ Telemetry Transport Protocol, Publish Ack

No.     Time           Source                Destination           Protocol Length Info
    304 34.708710      10.70.1.20            10.70.1.234           MQTT     87     Publish Message

Frame 304: 87 bytes on wire (696 bits), 87 bytes captured (696 bits) on interface 0
Ethernet II, Src: Giga-Byt_d1:2a:ce (90:2b:34:d1:2a:ce), Dst: Wibrain_30:18:81 (00:1e:06:30:18:81)
Internet Protocol Version 4, Src: 10.70.1.20, Dst: 10.70.1.234
Transmission Control Protocol, Src Port: 44882, Dst Port: 1883, Seq: 718, Ack: 89, Len: 33
MQ Telemetry Transport Protocol, Publish Message

No.     Time           Source                Destination           Protocol Length Info
    305 34.709598      10.70.1.234           10.70.1.20            MQTT     60     Publish Ack

Frame 305: 60 bytes on wire (480 bits), 60 bytes captured (480 bits) on interface 0
Ethernet II, Src: Wibrain_30:18:81 (00:1e:06:30:18:81), Dst: Giga-Byt_d1:2a:ce (90:2b:34:d1:2a:ce)
Internet Protocol Version 4, Src: 10.70.1.234, Dst: 10.70.1.20
Transmission Control Protocol, Src Port: 1883, Dst Port: 44882, Seq: 89, Ack: 751, Len: 4
MQ Telemetry Transport Protocol, Publish Ack

No.     Time           Source                Destination           Protocol Length Info
    308 34.709691      10.70.1.20            10.70.1.234           MQTT     112    Publish Message, Publish Message

Frame 308: 112 bytes on wire (896 bits), 112 bytes captured (896 bits) on interface 0
Ethernet II, Src: Giga-Byt_d1:2a:ce (90:2b:34:d1:2a:ce), Dst: Wibrain_30:18:81 (00:1e:06:30:18:81)
Internet Protocol Version 4, Src: 10.70.1.20, Dst: 10.70.1.234
Transmission Control Protocol, Src Port: 44882, Dst Port: 1883, Seq: 751, Ack: 93, Len: 58
MQ Telemetry Transport Protocol, Publish Message
MQ Telemetry Transport Protocol, Publish Message

No.     Time           Source                Destination           Protocol Length Info
    311 34.710463      10.70.1.234           10.70.1.20            MQTT     60     Publish Ack

Frame 311: 60 bytes on wire (480 bits), 60 bytes captured (480 bits) on interface 0
Ethernet II, Src: Wibrain_30:18:81 (00:1e:06:30:18:81), Dst: Giga-Byt_d1:2a:ce (90:2b:34:d1:2a:ce)
Internet Protocol Version 4, Src: 10.70.1.234, Dst: 10.70.1.20
Transmission Control Protocol, Src Port: 1883, Dst Port: 44882, Seq: 93, Ack: 809, Len: 4
MQ Telemetry Transport Protocol, Publish Ack

No.     Time           Source                Destination           Protocol Length Info
    328 34.751471      10.70.1.234           10.70.1.20            MQTT     60     Publish Ack

Frame 328: 60 bytes on wire (480 bits), 60 bytes captured (480 bits) on interface 0
Ethernet II, Src: Wibrain_30:18:81 (00:1e:06:30:18:81), Dst: Giga-Byt_d1:2a:ce (90:2b:34:d1:2a:ce)
Internet Protocol Version 4, Src: 10.70.1.234, Dst: 10.70.1.20
Transmission Control Protocol, Src Port: 1883, Dst Port: 44882, Seq: 97, Ack: 809, Len: 4
MQ Telemetry Transport Protocol, Publish Ack

No.     Time           Source                Destination           Protocol Length Info
    355 36.210763      10.70.1.20            10.70.1.234           MQTT     87     Publish Message

Frame 355: 87 bytes on wire (696 bits), 87 bytes captured (696 bits) on interface 0
Ethernet II, Src: Giga-Byt_d1:2a:ce (90:2b:34:d1:2a:ce), Dst: Wibrain_30:18:81 (00:1e:06:30:18:81)
Internet Protocol Version 4, Src: 10.70.1.20, Dst: 10.70.1.234
Transmission Control Protocol, Src Port: 44882, Dst Port: 1883, Seq: 809, Ack: 101, Len: 33
MQ Telemetry Transport Protocol, Publish Message

No.     Time           Source                Destination           Protocol Length Info
    356 36.211600      10.70.1.234           10.70.1.20            MQTT     60     Publish Ack

Frame 356: 60 bytes on wire (480 bits), 60 bytes captured (480 bits) on interface 0
Ethernet II, Src: Wibrain_30:18:81 (00:1e:06:30:18:81), Dst: Giga-Byt_d1:2a:ce (90:2b:34:d1:2a:ce)
Internet Protocol Version 4, Src: 10.70.1.234, Dst: 10.70.1.20
Transmission Control Protocol, Src Port: 1883, Dst Port: 44882, Seq: 101, Ack: 842, Len: 4
MQ Telemetry Transport Protocol, Publish Ack

No.     Time           Source                Destination           Protocol Length Info
    358 36.211673      10.70.1.20            10.70.1.234           MQTT     122    Publish Message, Publish Message

Frame 358: 122 bytes on wire (976 bits), 122 bytes captured (976 bits) on interface 0
Ethernet II, Src: Giga-Byt_d1:2a:ce (90:2b:34:d1:2a:ce), Dst: Wibrain_30:18:81 (00:1e:06:30:18:81)
Internet Protocol Version 4, Src: 10.70.1.20, Dst: 10.70.1.234
Transmission Control Protocol, Src Port: 44882, Dst Port: 1883, Seq: 842, Ack: 105, Len: 68
MQ Telemetry Transport Protocol, Publish Message
MQ Telemetry Transport Protocol, Publish Message

No.     Time           Source                Destination           Protocol Length Info
    362 36.212449      10.70.1.234           10.70.1.20            MQTT     60     Publish Ack

Frame 362: 60 bytes on wire (480 bits), 60 bytes captured (480 bits) on interface 0
Ethernet II, Src: Wibrain_30:18:81 (00:1e:06:30:18:81), Dst: Giga-Byt_d1:2a:ce (90:2b:34:d1:2a:ce)
Internet Protocol Version 4, Src: 10.70.1.234, Dst: 10.70.1.20
Transmission Control Protocol, Src Port: 1883, Dst Port: 44882, Seq: 105, Ack: 910, Len: 4
MQ Telemetry Transport Protocol, Publish Ack

No.     Time           Source                Destination           Protocol Length Info
    379 36.253078      10.70.1.234           10.70.1.20            MQTT     60     Publish Ack

Frame 379: 60 bytes on wire (480 bits), 60 bytes captured (480 bits) on interface 0
Ethernet II, Src: Wibrain_30:18:81 (00:1e:06:30:18:81), Dst: Giga-Byt_d1:2a:ce (90:2b:34:d1:2a:ce)
Internet Protocol Version 4, Src: 10.70.1.234, Dst: 10.70.1.20
Transmission Control Protocol, Src Port: 1883, Dst Port: 44882, Seq: 109, Ack: 910, Len: 4
MQ Telemetry Transport Protocol, Publish Ack

No.     Time           Source                Destination           Protocol Length Info
    384 36.510859      10.70.1.20            10.70.1.234           MQTT     87     Publish Message

Frame 384: 87 bytes on wire (696 bits), 87 bytes captured (696 bits) on interface 0
Ethernet II, Src: Giga-Byt_d1:2a:ce (90:2b:34:d1:2a:ce), Dst: Wibrain_30:18:81 (00:1e:06:30:18:81)
Internet Protocol Version 4, Src: 10.70.1.20, Dst: 10.70.1.234
Transmission Control Protocol, Src Port: 44882, Dst Port: 1883, Seq: 910, Ack: 113, Len: 33
MQ Telemetry Transport Protocol, Publish Message

No.     Time           Source                Destination           Protocol Length Info
    385 36.511695      10.70.1.234           10.70.1.20            MQTT     60     Publish Ack

Frame 385: 60 bytes on wire (480 bits), 60 bytes captured (480 bits) on interface 0
Ethernet II, Src: Wibrain_30:18:81 (00:1e:06:30:18:81), Dst: Giga-Byt_d1:2a:ce (90:2b:34:d1:2a:ce)
Internet Protocol Version 4, Src: 10.70.1.234, Dst: 10.70.1.20
Transmission Control Protocol, Src Port: 1883, Dst Port: 44882, Seq: 113, Ack: 943, Len: 4
MQ Telemetry Transport Protocol, Publish Ack

No.     Time           Source                Destination           Protocol Length Info
    387 36.511769      10.70.1.20            10.70.1.234           MQTT     112    Publish Message, Publish Message

Frame 387: 112 bytes on wire (896 bits), 112 bytes captured (896 bits) on interface 0
Ethernet II, Src: Giga-Byt_d1:2a:ce (90:2b:34:d1:2a:ce), Dst: Wibrain_30:18:81 (00:1e:06:30:18:81)
Internet Protocol Version 4, Src: 10.70.1.20, Dst: 10.70.1.234
Transmission Control Protocol, Src Port: 44882, Dst Port: 1883, Seq: 943, Ack: 117, Len: 58
MQ Telemetry Transport Protocol, Publish Message
MQ Telemetry Transport Protocol, Publish Message

No.     Time           Source                Destination           Protocol Length Info
    391 36.512619      10.70.1.234           10.70.1.20            MQTT     60     Publish Ack

Frame 391: 60 bytes on wire (480 bits), 60 bytes captured (480 bits) on interface 0
Ethernet II, Src: Wibrain_30:18:81 (00:1e:06:30:18:81), Dst: Giga-Byt_d1:2a:ce (90:2b:34:d1:2a:ce)
Internet Protocol Version 4, Src: 10.70.1.234, Dst: 10.70.1.20
Transmission Control Protocol, Src Port: 1883, Dst Port: 44882, Seq: 117, Ack: 1001, Len: 4
MQ Telemetry Transport Protocol, Publish Ack

No.     Time           Source                Destination           Protocol Length Info
    408 36.553508      10.70.1.234           10.70.1.20            MQTT     60     Publish Ack

Frame 408: 60 bytes on wire (480 bits), 60 bytes captured (480 bits) on interface 0
Ethernet II, Src: Wibrain_30:18:81 (00:1e:06:30:18:81), Dst: Giga-Byt_d1:2a:ce (90:2b:34:d1:2a:ce)
Internet Protocol Version 4, Src: 10.70.1.234, Dst: 10.70.1.20
Transmission Control Protocol, Src Port: 1883, Dst Port: 44882, Seq: 121, Ack: 1001, Len: 4
MQ Telemetry Transport Protocol, Publish Ack

No.     Time           Source                Destination           Protocol Length Info
    412 38.111067      10.70.1.20            10.70.1.234           MQTT     87     Publish Message

Frame 412: 87 bytes on wire (696 bits), 87 bytes captured (696 bits) on interface 0
Ethernet II, Src: Giga-Byt_d1:2a:ce (90:2b:34:d1:2a:ce), Dst: Wibrain_30:18:81 (00:1e:06:30:18:81)
Internet Protocol Version 4, Src: 10.70.1.20, Dst: 10.70.1.234
Transmission Control Protocol, Src Port: 44882, Dst Port: 1883, Seq: 1001, Ack: 125, Len: 33
MQ Telemetry Transport Protocol, Publish Message

No.     Time           Source                Destination           Protocol Length Info
    413 38.111906      10.70.1.234           10.70.1.20            MQTT     60     Publish Ack

Frame 413: 60 bytes on wire (480 bits), 60 bytes captured (480 bits) on interface 0
Ethernet II, Src: Wibrain_30:18:81 (00:1e:06:30:18:81), Dst: Giga-Byt_d1:2a:ce (90:2b:34:d1:2a:ce)
Internet Protocol Version 4, Src: 10.70.1.234, Dst: 10.70.1.20
Transmission Control Protocol, Src Port: 1883, Dst Port: 44882, Seq: 125, Ack: 1034, Len: 4
MQ Telemetry Transport Protocol, Publish Ack

No.     Time           Source                Destination           Protocol Length Info
    415 38.111992      10.70.1.20            10.70.1.234           MQTT     122    Publish Message, Publish Message

Frame 415: 122 bytes on wire (976 bits), 122 bytes captured (976 bits) on interface 0
Ethernet II, Src: Giga-Byt_d1:2a:ce (90:2b:34:d1:2a:ce), Dst: Wibrain_30:18:81 (00:1e:06:30:18:81)
Internet Protocol Version 4, Src: 10.70.1.20, Dst: 10.70.1.234
Transmission Control Protocol, Src Port: 44882, Dst Port: 1883, Seq: 1034, Ack: 129, Len: 68
MQ Telemetry Transport Protocol, Publish Message
MQ Telemetry Transport Protocol, Publish Message

No.     Time           Source                Destination           Protocol Length Info
    419 38.112827      10.70.1.234           10.70.1.20            MQTT     60     Publish Ack

Frame 419: 60 bytes on wire (480 bits), 60 bytes captured (480 bits) on interface 0
Ethernet II, Src: Wibrain_30:18:81 (00:1e:06:30:18:81), Dst: Giga-Byt_d1:2a:ce (90:2b:34:d1:2a:ce)
Internet Protocol Version 4, Src: 10.70.1.234, Dst: 10.70.1.20
Transmission Control Protocol, Src Port: 1883, Dst Port: 44882, Seq: 129, Ack: 1102, Len: 4
MQ Telemetry Transport Protocol, Publish Ack

No.     Time           Source                Destination           Protocol Length Info
    435 38.152974      10.70.1.234           10.70.1.20            MQTT     60     Publish Ack

Frame 435: 60 bytes on wire (480 bits), 60 bytes captured (480 bits) on interface 0
Ethernet II, Src: Wibrain_30:18:81 (00:1e:06:30:18:81), Dst: Giga-Byt_d1:2a:ce (90:2b:34:d1:2a:ce)
Internet Protocol Version 4, Src: 10.70.1.234, Dst: 10.70.1.20
Transmission Control Protocol, Src Port: 1883, Dst Port: 44882, Seq: 133, Ack: 1102, Len: 4
MQ Telemetry Transport Protocol, Publish Ack

No.     Time           Source                Destination           Protocol Length Info
    437 38.712374      10.70.1.20            10.70.1.234           MQTT     87     Publish Message

Frame 437: 87 bytes on wire (696 bits), 87 bytes captured (696 bits) on interface 0
Ethernet II, Src: Giga-Byt_d1:2a:ce (90:2b:34:d1:2a:ce), Dst: Wibrain_30:18:81 (00:1e:06:30:18:81)
Internet Protocol Version 4, Src: 10.70.1.20, Dst: 10.70.1.234
Transmission Control Protocol, Src Port: 44882, Dst Port: 1883, Seq: 1102, Ack: 137, Len: 33
MQ Telemetry Transport Protocol, Publish Message

No.     Time           Source                Destination           Protocol Length Info
    438 38.713271      10.70.1.234           10.70.1.20            MQTT     60     Publish Ack

Frame 438: 60 bytes on wire (480 bits), 60 bytes captured (480 bits) on interface 0
Ethernet II, Src: Wibrain_30:18:81 (00:1e:06:30:18:81), Dst: Giga-Byt_d1:2a:ce (90:2b:34:d1:2a:ce)
Internet Protocol Version 4, Src: 10.70.1.234, Dst: 10.70.1.20
Transmission Control Protocol, Src Port: 1883, Dst Port: 44882, Seq: 137, Ack: 1135, Len: 4
MQ Telemetry Transport Protocol, Publish Ack

No.     Time           Source                Destination           Protocol Length Info
    441 38.713340      10.70.1.20            10.70.1.234           MQTT     112    Publish Message, Publish Message

Frame 441: 112 bytes on wire (896 bits), 112 bytes captured (896 bits) on interface 0
Ethernet II, Src: Giga-Byt_d1:2a:ce (90:2b:34:d1:2a:ce), Dst: Wibrain_30:18:81 (00:1e:06:30:18:81)
Internet Protocol Version 4, Src: 10.70.1.20, Dst: 10.70.1.234
Transmission Control Protocol, Src Port: 44882, Dst Port: 1883, Seq: 1135, Ack: 141, Len: 58
MQ Telemetry Transport Protocol, Publish Message
MQ Telemetry Transport Protocol, Publish Message

No.     Time           Source                Destination           Protocol Length Info
    445 38.714135      10.70.1.234           10.70.1.20            MQTT     60     Publish Ack

Frame 445: 60 bytes on wire (480 bits), 60 bytes captured (480 bits) on interface 0
Ethernet II, Src: Wibrain_30:18:81 (00:1e:06:30:18:81), Dst: Giga-Byt_d1:2a:ce (90:2b:34:d1:2a:ce)
Internet Protocol Version 4, Src: 10.70.1.234, Dst: 10.70.1.20
Transmission Control Protocol, Src Port: 1883, Dst Port: 44882, Seq: 141, Ack: 1193, Len: 4
MQ Telemetry Transport Protocol, Publish Ack

No.     Time           Source                Destination           Protocol Length Info
    461 38.755530      10.70.1.234           10.70.1.20            MQTT     60     Publish Ack

Frame 461: 60 bytes on wire (480 bits), 60 bytes captured (480 bits) on interface 0
Ethernet II, Src: Wibrain_30:18:81 (00:1e:06:30:18:81), Dst: Giga-Byt_d1:2a:ce (90:2b:34:d1:2a:ce)
Internet Protocol Version 4, Src: 10.70.1.234, Dst: 10.70.1.20
Transmission Control Protocol, Src Port: 1883, Dst Port: 44882, Seq: 145, Ack: 1193, Len: 4
MQ Telemetry Transport Protocol, Publish Ack

No.     Time           Source                Destination           Protocol Length Info
    464 40.213120      10.70.1.20            10.70.1.234           MQTT     87     Publish Message

Frame 464: 87 bytes on wire (696 bits), 87 bytes captured (696 bits) on interface 0
Ethernet II, Src: Giga-Byt_d1:2a:ce (90:2b:34:d1:2a:ce), Dst: Wibrain_30:18:81 (00:1e:06:30:18:81)
Internet Protocol Version 4, Src: 10.70.1.20, Dst: 10.70.1.234
Transmission Control Protocol, Src Port: 44882, Dst Port: 1883, Seq: 1193, Ack: 149, Len: 33
MQ Telemetry Transport Protocol, Publish Message

No.     Time           Source                Destination           Protocol Length Info
    465 40.214022      10.70.1.234           10.70.1.20            MQTT     60     Publish Ack

Frame 465: 60 bytes on wire (480 bits), 60 bytes captured (480 bits) on interface 0
Ethernet II, Src: Wibrain_30:18:81 (00:1e:06:30:18:81), Dst: Giga-Byt_d1:2a:ce (90:2b:34:d1:2a:ce)
Internet Protocol Version 4, Src: 10.70.1.234, Dst: 10.70.1.20
Transmission Control Protocol, Src Port: 1883, Dst Port: 44882, Seq: 149, Ack: 1226, Len: 4
MQ Telemetry Transport Protocol, Publish Ack

No.     Time           Source                Destination           Protocol Length Info
    467 40.214098      10.70.1.20            10.70.1.234           MQTT     122    Publish Message, Publish Message

Frame 467: 122 bytes on wire (976 bits), 122 bytes captured (976 bits) on interface 0
Ethernet II, Src: Giga-Byt_d1:2a:ce (90:2b:34:d1:2a:ce), Dst: Wibrain_30:18:81 (00:1e:06:30:18:81)
Internet Protocol Version 4, Src: 10.70.1.20, Dst: 10.70.1.234
Transmission Control Protocol, Src Port: 44882, Dst Port: 1883, Seq: 1226, Ack: 153, Len: 68
MQ Telemetry Transport Protocol, Publish Message
MQ Telemetry Transport Protocol, Publish Message

No.     Time           Source                Destination           Protocol Length Info
    471 40.214881      10.70.1.234           10.70.1.20            MQTT     60     Publish Ack

Frame 471: 60 bytes on wire (480 bits), 60 bytes captured (480 bits) on interface 0
Ethernet II, Src: Wibrain_30:18:81 (00:1e:06:30:18:81), Dst: Giga-Byt_d1:2a:ce (90:2b:34:d1:2a:ce)
Internet Protocol Version 4, Src: 10.70.1.234, Dst: 10.70.1.20
Transmission Control Protocol, Src Port: 1883, Dst Port: 44882, Seq: 153, Ack: 1294, Len: 4
MQ Telemetry Transport Protocol, Publish Ack

No.     Time           Source                Destination           Protocol Length Info
    487 40.255242      10.70.1.234           10.70.1.20            MQTT     60     Publish Ack

Frame 487: 60 bytes on wire (480 bits), 60 bytes captured (480 bits) on interface 0
Ethernet II, Src: Wibrain_30:18:81 (00:1e:06:30:18:81), Dst: Giga-Byt_d1:2a:ce (90:2b:34:d1:2a:ce)
Internet Protocol Version 4, Src: 10.70.1.234, Dst: 10.70.1.20
Transmission Control Protocol, Src Port: 1883, Dst Port: 44882, Seq: 157, Ack: 1294, Len: 4
MQ Telemetry Transport Protocol, Publish Ack

No.     Time           Source                Destination           Protocol Length Info
    489 40.513192      10.70.1.20            10.70.1.234           MQTT     87     Publish Message

Frame 489: 87 bytes on wire (696 bits), 87 bytes captured (696 bits) on interface 0
Ethernet II, Src: Giga-Byt_d1:2a:ce (90:2b:34:d1:2a:ce), Dst: Wibrain_30:18:81 (00:1e:06:30:18:81)
Internet Protocol Version 4, Src: 10.70.1.20, Dst: 10.70.1.234
Transmission Control Protocol, Src Port: 44882, Dst Port: 1883, Seq: 1294, Ack: 161, Len: 33
MQ Telemetry Transport Protocol, Publish Message

No.     Time           Source                Destination           Protocol Length Info
    490 40.513971      10.70.1.234           10.70.1.20            MQTT     60     Publish Ack

Frame 490: 60 bytes on wire (480 bits), 60 bytes captured (480 bits) on interface 0
Ethernet II, Src: Wibrain_30:18:81 (00:1e:06:30:18:81), Dst: Giga-Byt_d1:2a:ce (90:2b:34:d1:2a:ce)
Internet Protocol Version 4, Src: 10.70.1.234, Dst: 10.70.1.20
Transmission Control Protocol, Src Port: 1883, Dst Port: 44882, Seq: 161, Ack: 1327, Len: 4
MQ Telemetry Transport Protocol, Publish Ack

No.     Time           Source                Destination           Protocol Length Info
    498 40.626672      10.70.1.20            10.70.1.234           MQTT     88     Publish Message

Frame 498: 88 bytes on wire (704 bits), 88 bytes captured (704 bits) on interface 0
Ethernet II, Src: Giga-Byt_d1:2a:ce (90:2b:34:d1:2a:ce), Dst: Wibrain_30:18:81 (00:1e:06:30:18:81)
Internet Protocol Version 4, Src: 10.70.1.20, Dst: 10.70.1.234
Transmission Control Protocol, Src Port: 44882, Dst Port: 1883, Seq: 1327, Ack: 165, Len: 34
MQ Telemetry Transport Protocol, Publish Message

No.     Time           Source                Destination           Protocol Length Info
    499 40.627481      10.70.1.234           10.70.1.20            MQTT     60     Publish Ack

Frame 499: 60 bytes on wire (480 bits), 60 bytes captured (480 bits) on interface 0
Ethernet II, Src: Wibrain_30:18:81 (00:1e:06:30:18:81), Dst: Giga-Byt_d1:2a:ce (90:2b:34:d1:2a:ce)
Internet Protocol Version 4, Src: 10.70.1.234, Dst: 10.70.1.20
Transmission Control Protocol, Src Port: 1883, Dst Port: 44882, Seq: 165, Ack: 1361, Len: 4
MQ Telemetry Transport Protocol, Publish Ack

No.     Time           Source                Destination           Protocol Length Info
    501 40.627578      10.70.1.20            10.70.1.234           MQTT     78     Publish Message

Frame 501: 78 bytes on wire (624 bits), 78 bytes captured (624 bits) on interface 0
Ethernet II, Src: Giga-Byt_d1:2a:ce (90:2b:34:d1:2a:ce), Dst: Wibrain_30:18:81 (00:1e:06:30:18:81)
Internet Protocol Version 4, Src: 10.70.1.20, Dst: 10.70.1.234
Transmission Control Protocol, Src Port: 44882, Dst Port: 1883, Seq: 1361, Ack: 169, Len: 24
MQ Telemetry Transport Protocol, Publish Message

No.     Time           Source                Destination           Protocol Length Info
    505 40.628341      10.70.1.234           10.70.1.20            MQTT     60     Publish Ack

Frame 505: 60 bytes on wire (480 bits), 60 bytes captured (480 bits) on interface 0
Ethernet II, Src: Wibrain_30:18:81 (00:1e:06:30:18:81), Dst: Giga-Byt_d1:2a:ce (90:2b:34:d1:2a:ce)
Internet Protocol Version 4, Src: 10.70.1.234, Dst: 10.70.1.20
Transmission Control Protocol, Src Port: 1883, Dst Port: 44882, Seq: 169, Ack: 1385, Len: 4
MQ Telemetry Transport Protocol, Publish Ack

No.     Time           Source                Destination           Protocol Length Info
    516 42.128958      10.70.1.20            10.70.1.234           MQTT     87     Publish Message

Frame 516: 87 bytes on wire (696 bits), 87 bytes captured (696 bits) on interface 0
Ethernet II, Src: Giga-Byt_d1:2a:ce (90:2b:34:d1:2a:ce), Dst: Wibrain_30:18:81 (00:1e:06:30:18:81)
Internet Protocol Version 4, Src: 10.70.1.20, Dst: 10.70.1.234
Transmission Control Protocol, Src Port: 44882, Dst Port: 1883, Seq: 1385, Ack: 173, Len: 33
MQ Telemetry Transport Protocol, Publish Message

No.     Time           Source                Destination           Protocol Length Info
    517 42.129840      10.70.1.234           10.70.1.20            MQTT     60     Publish Ack

Frame 517: 60 bytes on wire (480 bits), 60 bytes captured (480 bits) on interface 0
Ethernet II, Src: Wibrain_30:18:81 (00:1e:06:30:18:81), Dst: Giga-Byt_d1:2a:ce (90:2b:34:d1:2a:ce)
Internet Protocol Version 4, Src: 10.70.1.234, Dst: 10.70.1.20
Transmission Control Protocol, Src Port: 1883, Dst Port: 44882, Seq: 173, Ack: 1418, Len: 4
MQ Telemetry Transport Protocol, Publish Ack

No.     Time           Source                Destination           Protocol Length Info
    520 42.129921      10.70.1.20            10.70.1.234           MQTT     122    Publish Message, Publish Message

Frame 520: 122 bytes on wire (976 bits), 122 bytes captured (976 bits) on interface 0
Ethernet II, Src: Giga-Byt_d1:2a:ce (90:2b:34:d1:2a:ce), Dst: Wibrain_30:18:81 (00:1e:06:30:18:81)
Internet Protocol Version 4, Src: 10.70.1.20, Dst: 10.70.1.234
Transmission Control Protocol, Src Port: 44882, Dst Port: 1883, Seq: 1418, Ack: 177, Len: 68
MQ Telemetry Transport Protocol, Publish Message
MQ Telemetry Transport Protocol, Publish Message

No.     Time           Source                Destination           Protocol Length Info
    523 42.130723      10.70.1.234           10.70.1.20            MQTT     60     Publish Ack

Frame 523: 60 bytes on wire (480 bits), 60 bytes captured (480 bits) on interface 0
Ethernet II, Src: Wibrain_30:18:81 (00:1e:06:30:18:81), Dst: Giga-Byt_d1:2a:ce (90:2b:34:d1:2a:ce)
Internet Protocol Version 4, Src: 10.70.1.234, Dst: 10.70.1.20
Transmission Control Protocol, Src Port: 1883, Dst Port: 44882, Seq: 177, Ack: 1486, Len: 4
MQ Telemetry Transport Protocol, Publish Ack

No.     Time           Source                Destination           Protocol Length Info
    539 42.171368      10.70.1.234           10.70.1.20            MQTT     60     Publish Ack

Frame 539: 60 bytes on wire (480 bits), 60 bytes captured (480 bits) on interface 0
Ethernet II, Src: Wibrain_30:18:81 (00:1e:06:30:18:81), Dst: Giga-Byt_d1:2a:ce (90:2b:34:d1:2a:ce)
Internet Protocol Version 4, Src: 10.70.1.234, Dst: 10.70.1.20
Transmission Control Protocol, Src Port: 1883, Dst Port: 44882, Seq: 181, Ack: 1486, Len: 4
MQ Telemetry Transport Protocol, Publish Ack

No.     Time           Source                Destination           Protocol Length Info
    541 42.429739      10.70.1.20            10.70.1.234           MQTT     87     Publish Message

Frame 541: 87 bytes on wire (696 bits), 87 bytes captured (696 bits) on interface 0
Ethernet II, Src: Giga-Byt_d1:2a:ce (90:2b:34:d1:2a:ce), Dst: Wibrain_30:18:81 (00:1e:06:30:18:81)
Internet Protocol Version 4, Src: 10.70.1.20, Dst: 10.70.1.234
Transmission Control Protocol, Src Port: 44882, Dst Port: 1883, Seq: 1486, Ack: 185, Len: 33
MQ Telemetry Transport Protocol, Publish Message

No.     Time           Source                Destination           Protocol Length Info
    542 42.430617      10.70.1.234           10.70.1.20            MQTT     60     Publish Ack

Frame 542: 60 bytes on wire (480 bits), 60 bytes captured (480 bits) on interface 0
Ethernet II, Src: Wibrain_30:18:81 (00:1e:06:30:18:81), Dst: Giga-Byt_d1:2a:ce (90:2b:34:d1:2a:ce)
Internet Protocol Version 4, Src: 10.70.1.234, Dst: 10.70.1.20
Transmission Control Protocol, Src Port: 1883, Dst Port: 44882, Seq: 185, Ack: 1519, Len: 4
MQ Telemetry Transport Protocol, Publish Ack

No.     Time           Source                Destination           Protocol Length Info
    545 42.430679      10.70.1.20            10.70.1.234           MQTT     112    Publish Message, Publish Message

Frame 545: 112 bytes on wire (896 bits), 112 bytes captured (896 bits) on interface 0
Ethernet II, Src: Giga-Byt_d1:2a:ce (90:2b:34:d1:2a:ce), Dst: Wibrain_30:18:81 (00:1e:06:30:18:81)
Internet Protocol Version 4, Src: 10.70.1.20, Dst: 10.70.1.234
Transmission Control Protocol, Src Port: 44882, Dst Port: 1883, Seq: 1519, Ack: 189, Len: 58
MQ Telemetry Transport Protocol, Publish Message
MQ Telemetry Transport Protocol, Publish Message

No.     Time           Source                Destination           Protocol Length Info
    548 42.431508      10.70.1.234           10.70.1.20            MQTT     60     Publish Ack

Frame 548: 60 bytes on wire (480 bits), 60 bytes captured (480 bits) on interface 0
Ethernet II, Src: Wibrain_30:18:81 (00:1e:06:30:18:81), Dst: Giga-Byt_d1:2a:ce (90:2b:34:d1:2a:ce)
Internet Protocol Version 4, Src: 10.70.1.234, Dst: 10.70.1.20
Transmission Control Protocol, Src Port: 1883, Dst Port: 44882, Seq: 189, Ack: 1577, Len: 4
MQ Telemetry Transport Protocol, Publish Ack

No.     Time           Source                Destination           Protocol Length Info
    568 42.472631      10.70.1.234           10.70.1.20            MQTT     60     Publish Ack

Frame 568: 60 bytes on wire (480 bits), 60 bytes captured (480 bits) on interface 0
Ethernet II, Src: Wibrain_30:18:81 (00:1e:06:30:18:81), Dst: Giga-Byt_d1:2a:ce (90:2b:34:d1:2a:ce)
Internet Protocol Version 4, Src: 10.70.1.234, Dst: 10.70.1.20
Transmission Control Protocol, Src Port: 1883, Dst Port: 44882, Seq: 193, Ack: 1577, Len: 4
MQ Telemetry Transport Protocol, Publish Ack

No.     Time           Source                Destination           Protocol Length Info
    572 44.232077      10.70.1.20            10.70.1.234           MQTT     87     Publish Message

Frame 572: 87 bytes on wire (696 bits), 87 bytes captured (696 bits) on interface 0
Ethernet II, Src: Giga-Byt_d1:2a:ce (90:2b:34:d1:2a:ce), Dst: Wibrain_30:18:81 (00:1e:06:30:18:81)
Internet Protocol Version 4, Src: 10.70.1.20, Dst: 10.70.1.234
Transmission Control Protocol, Src Port: 44882, Dst Port: 1883, Seq: 1577, Ack: 197, Len: 33
MQ Telemetry Transport Protocol, Publish Message

No.     Time           Source                Destination           Protocol Length Info
    573 44.232936      10.70.1.234           10.70.1.20            MQTT     60     Publish Ack

Frame 573: 60 bytes on wire (480 bits), 60 bytes captured (480 bits) on interface 0
Ethernet II, Src: Wibrain_30:18:81 (00:1e:06:30:18:81), Dst: Giga-Byt_d1:2a:ce (90:2b:34:d1:2a:ce)
Internet Protocol Version 4, Src: 10.70.1.234, Dst: 10.70.1.20
Transmission Control Protocol, Src Port: 1883, Dst Port: 44882, Seq: 197, Ack: 1610, Len: 4
MQ Telemetry Transport Protocol, Publish Ack

No.     Time           Source                Destination           Protocol Length Info
    574 44.232989      10.70.1.20            10.70.1.234           MQTT     88     Publish Message

Frame 574: 88 bytes on wire (704 bits), 88 bytes captured (704 bits) on interface 0
Ethernet II, Src: Giga-Byt_d1:2a:ce (90:2b:34:d1:2a:ce), Dst: Wibrain_30:18:81 (00:1e:06:30:18:81)
Internet Protocol Version 4, Src: 10.70.1.20, Dst: 10.70.1.234
Transmission Control Protocol, Src Port: 44882, Dst Port: 1883, Seq: 1610, Ack: 201, Len: 34
MQ Telemetry Transport Protocol, Publish Message

No.     Time           Source                Destination           Protocol Length Info
    579 44.233747      10.70.1.234           10.70.1.20            MQTT     60     Publish Ack

Frame 579: 60 bytes on wire (480 bits), 60 bytes captured (480 bits) on interface 0
Ethernet II, Src: Wibrain_30:18:81 (00:1e:06:30:18:81), Dst: Giga-Byt_d1:2a:ce (90:2b:34:d1:2a:ce)
Internet Protocol Version 4, Src: 10.70.1.234, Dst: 10.70.1.20
Transmission Control Protocol, Src Port: 1883, Dst Port: 44882, Seq: 201, Ack: 1644, Len: 4
MQ Telemetry Transport Protocol, Publish Ack

No.     Time           Source                Destination           Protocol Length Info
    589 44.342107      10.70.1.20            10.70.1.234           MQTT     88     Publish Message

Frame 589: 88 bytes on wire (704 bits), 88 bytes captured (704 bits) on interface 0
Ethernet II, Src: Giga-Byt_d1:2a:ce (90:2b:34:d1:2a:ce), Dst: Wibrain_30:18:81 (00:1e:06:30:18:81)
Internet Protocol Version 4, Src: 10.70.1.20, Dst: 10.70.1.234
Transmission Control Protocol, Src Port: 44882, Dst Port: 1883, Seq: 1644, Ack: 205, Len: 34
MQ Telemetry Transport Protocol, Publish Message

No.     Time           Source                Destination           Protocol Length Info
    590 44.342916      10.70.1.234           10.70.1.20            MQTT     60     Publish Ack

Frame 590: 60 bytes on wire (480 bits), 60 bytes captured (480 bits) on interface 0
Ethernet II, Src: Wibrain_30:18:81 (00:1e:06:30:18:81), Dst: Giga-Byt_d1:2a:ce (90:2b:34:d1:2a:ce)
Internet Protocol Version 4, Src: 10.70.1.234, Dst: 10.70.1.20
Transmission Control Protocol, Src Port: 1883, Dst Port: 44882, Seq: 205, Ack: 1678, Len: 4
MQ Telemetry Transport Protocol, Publish Ack

No.     Time           Source                Destination           Protocol Length Info
    598 44.642133      10.70.1.20            10.70.1.234           MQTT     87     Publish Message

Frame 598: 87 bytes on wire (696 bits), 87 bytes captured (696 bits) on interface 0
Ethernet II, Src: Giga-Byt_d1:2a:ce (90:2b:34:d1:2a:ce), Dst: Wibrain_30:18:81 (00:1e:06:30:18:81)
Internet Protocol Version 4, Src: 10.70.1.20, Dst: 10.70.1.234
Transmission Control Protocol, Src Port: 44882, Dst Port: 1883, Seq: 1678, Ack: 209, Len: 33
MQ Telemetry Transport Protocol, Publish Message

No.     Time           Source                Destination           Protocol Length Info
    599 44.642933      10.70.1.234           10.70.1.20            MQTT     60     Publish Ack

Frame 599: 60 bytes on wire (480 bits), 60 bytes captured (480 bits) on interface 0
Ethernet II, Src: Wibrain_30:18:81 (00:1e:06:30:18:81), Dst: Giga-Byt_d1:2a:ce (90:2b:34:d1:2a:ce)
Internet Protocol Version 4, Src: 10.70.1.234, Dst: 10.70.1.20
Transmission Control Protocol, Src Port: 1883, Dst Port: 44882, Seq: 209, Ack: 1711, Len: 4
MQ Telemetry Transport Protocol, Publish Ack

No.     Time           Source                Destination           Protocol Length Info
    601 44.643000      10.70.1.20            10.70.1.234           MQTT     112    Publish Message, Publish Message

Frame 601: 112 bytes on wire (896 bits), 112 bytes captured (896 bits) on interface 0
Ethernet II, Src: Giga-Byt_d1:2a:ce (90:2b:34:d1:2a:ce), Dst: Wibrain_30:18:81 (00:1e:06:30:18:81)
Internet Protocol Version 4, Src: 10.70.1.20, Dst: 10.70.1.234
Transmission Control Protocol, Src Port: 44882, Dst Port: 1883, Seq: 1711, Ack: 213, Len: 58
MQ Telemetry Transport Protocol, Publish Message
MQ Telemetry Transport Protocol, Publish Message

No.     Time           Source                Destination           Protocol Length Info
    605 44.643867      10.70.1.234           10.70.1.20            MQTT     60     Publish Ack

Frame 605: 60 bytes on wire (480 bits), 60 bytes captured (480 bits) on interface 0
Ethernet II, Src: Wibrain_30:18:81 (00:1e:06:30:18:81), Dst: Giga-Byt_d1:2a:ce (90:2b:34:d1:2a:ce)
Internet Protocol Version 4, Src: 10.70.1.234, Dst: 10.70.1.20
Transmission Control Protocol, Src Port: 1883, Dst Port: 44882, Seq: 213, Ack: 1769, Len: 4
MQ Telemetry Transport Protocol, Publish Ack

No.     Time           Source                Destination           Protocol Length Info
    621 44.683951      10.70.1.234           10.70.1.20            MQTT     60     Publish Ack

Frame 621: 60 bytes on wire (480 bits), 60 bytes captured (480 bits) on interface 0
Ethernet II, Src: Wibrain_30:18:81 (00:1e:06:30:18:81), Dst: Giga-Byt_d1:2a:ce (90:2b:34:d1:2a:ce)
Internet Protocol Version 4, Src: 10.70.1.234, Dst: 10.70.1.20
Transmission Control Protocol, Src Port: 1883, Dst Port: 44882, Seq: 217, Ack: 1769, Len: 4
MQ Telemetry Transport Protocol, Publish Ack

No.     Time           Source                Destination           Protocol Length Info
    624 46.143531      10.70.1.20            10.70.1.234           MQTT     87     Publish Message

Frame 624: 87 bytes on wire (696 bits), 87 bytes captured (696 bits) on interface 0
Ethernet II, Src: Giga-Byt_d1:2a:ce (90:2b:34:d1:2a:ce), Dst: Wibrain_30:18:81 (00:1e:06:30:18:81)
Internet Protocol Version 4, Src: 10.70.1.20, Dst: 10.70.1.234
Transmission Control Protocol, Src Port: 44882, Dst Port: 1883, Seq: 1769, Ack: 221, Len: 33
MQ Telemetry Transport Protocol, Publish Message

No.     Time           Source                Destination           Protocol Length Info
    625 46.144404      10.70.1.234           10.70.1.20            MQTT     60     Publish Ack

Frame 625: 60 bytes on wire (480 bits), 60 bytes captured (480 bits) on interface 0
Ethernet II, Src: Wibrain_30:18:81 (00:1e:06:30:18:81), Dst: Giga-Byt_d1:2a:ce (90:2b:34:d1:2a:ce)
Internet Protocol Version 4, Src: 10.70.1.234, Dst: 10.70.1.20
Transmission Control Protocol, Src Port: 1883, Dst Port: 44882, Seq: 221, Ack: 1802, Len: 4
MQ Telemetry Transport Protocol, Publish Ack

No.     Time           Source                Destination           Protocol Length Info
    627 46.144496      10.70.1.20            10.70.1.234           MQTT     122    Publish Message, Publish Message

Frame 627: 122 bytes on wire (976 bits), 122 bytes captured (976 bits) on interface 0
Ethernet II, Src: Giga-Byt_d1:2a:ce (90:2b:34:d1:2a:ce), Dst: Wibrain_30:18:81 (00:1e:06:30:18:81)
Internet Protocol Version 4, Src: 10.70.1.20, Dst: 10.70.1.234
Transmission Control Protocol, Src Port: 44882, Dst Port: 1883, Seq: 1802, Ack: 225, Len: 68
MQ Telemetry Transport Protocol, Publish Message
MQ Telemetry Transport Protocol, Publish Message

No.     Time           Source                Destination           Protocol Length Info
    631 46.145335      10.70.1.234           10.70.1.20            MQTT     60     Publish Ack

Frame 631: 60 bytes on wire (480 bits), 60 bytes captured (480 bits) on interface 0
Ethernet II, Src: Wibrain_30:18:81 (00:1e:06:30:18:81), Dst: Giga-Byt_d1:2a:ce (90:2b:34:d1:2a:ce)
Internet Protocol Version 4, Src: 10.70.1.234, Dst: 10.70.1.20
Transmission Control Protocol, Src Port: 1883, Dst Port: 44882, Seq: 225, Ack: 1870, Len: 4
MQ Telemetry Transport Protocol, Publish Ack

No.     Time           Source                Destination           Protocol Length Info
    647 46.185736      10.70.1.234           10.70.1.20            MQTT     60     Publish Ack

Frame 647: 60 bytes on wire (480 bits), 60 bytes captured (480 bits) on interface 0
Ethernet II, Src: Wibrain_30:18:81 (00:1e:06:30:18:81), Dst: Giga-Byt_d1:2a:ce (90:2b:34:d1:2a:ce)
Internet Protocol Version 4, Src: 10.70.1.234, Dst: 10.70.1.20
Transmission Control Protocol, Src Port: 1883, Dst Port: 44882, Seq: 229, Ack: 1870, Len: 4
MQ Telemetry Transport Protocol, Publish Ack

No.     Time           Source                Destination           Protocol Length Info
    649 46.443797      10.70.1.20            10.70.1.234           MQTT     87     Publish Message

Frame 649: 87 bytes on wire (696 bits), 87 bytes captured (696 bits) on interface 0
Ethernet II, Src: Giga-Byt_d1:2a:ce (90:2b:34:d1:2a:ce), Dst: Wibrain_30:18:81 (00:1e:06:30:18:81)
Internet Protocol Version 4, Src: 10.70.1.20, Dst: 10.70.1.234
Transmission Control Protocol, Src Port: 44882, Dst Port: 1883, Seq: 1870, Ack: 233, Len: 33
MQ Telemetry Transport Protocol, Publish Message

No.     Time           Source                Destination           Protocol Length Info
    650 46.444621      10.70.1.234           10.70.1.20            MQTT     60     Publish Ack

Frame 650: 60 bytes on wire (480 bits), 60 bytes captured (480 bits) on interface 0
Ethernet II, Src: Wibrain_30:18:81 (00:1e:06:30:18:81), Dst: Giga-Byt_d1:2a:ce (90:2b:34:d1:2a:ce)
Internet Protocol Version 4, Src: 10.70.1.234, Dst: 10.70.1.20
Transmission Control Protocol, Src Port: 1883, Dst Port: 44882, Seq: 233, Ack: 1903, Len: 4
MQ Telemetry Transport Protocol, Publish Ack

No.     Time           Source                Destination           Protocol Length Info
    652 46.444678      10.70.1.20            10.70.1.234           MQTT     112    Publish Message, Publish Message

Frame 652: 112 bytes on wire (896 bits), 112 bytes captured (896 bits) on interface 0
Ethernet II, Src: Giga-Byt_d1:2a:ce (90:2b:34:d1:2a:ce), Dst: Wibrain_30:18:81 (00:1e:06:30:18:81)
Internet Protocol Version 4, Src: 10.70.1.20, Dst: 10.70.1.234
Transmission Control Protocol, Src Port: 44882, Dst Port: 1883, Seq: 1903, Ack: 237, Len: 58
MQ Telemetry Transport Protocol, Publish Message
MQ Telemetry Transport Protocol, Publish Message

No.     Time           Source                Destination           Protocol Length Info
    656 46.445483      10.70.1.234           10.70.1.20            MQTT     60     Publish Ack

Frame 656: 60 bytes on wire (480 bits), 60 bytes captured (480 bits) on interface 0
Ethernet II, Src: Wibrain_30:18:81 (00:1e:06:30:18:81), Dst: Giga-Byt_d1:2a:ce (90:2b:34:d1:2a:ce)
Internet Protocol Version 4, Src: 10.70.1.234, Dst: 10.70.1.20
Transmission Control Protocol, Src Port: 1883, Dst Port: 44882, Seq: 237, Ack: 1961, Len: 4
MQ Telemetry Transport Protocol, Publish Ack

No.     Time           Source                Destination           Protocol Length Info
    672 46.486555      10.70.1.234           10.70.1.20            MQTT     60     Publish Ack

Frame 672: 60 bytes on wire (480 bits), 60 bytes captured (480 bits) on interface 0
Ethernet II, Src: Wibrain_30:18:81 (00:1e:06:30:18:81), Dst: Giga-Byt_d1:2a:ce (90:2b:34:d1:2a:ce)
Internet Protocol Version 4, Src: 10.70.1.234, Dst: 10.70.1.20
Transmission Control Protocol, Src Port: 1883, Dst Port: 44882, Seq: 241, Ack: 1961, Len: 4
MQ Telemetry Transport Protocol, Publish Ack

No.     Time           Source                Destination           Protocol Length Info
    686 48.343771      10.70.1.20            10.70.1.234           MQTT     87     Publish Message

Frame 686: 87 bytes on wire (696 bits), 87 bytes captured (696 bits) on interface 0
Ethernet II, Src: Giga-Byt_d1:2a:ce (90:2b:34:d1:2a:ce), Dst: Wibrain_30:18:81 (00:1e:06:30:18:81)
Internet Protocol Version 4, Src: 10.70.1.20, Dst: 10.70.1.234
Transmission Control Protocol, Src Port: 44882, Dst Port: 1883, Seq: 1961, Ack: 245, Len: 33
MQ Telemetry Transport Protocol, Publish Message

No.     Time           Source                Destination           Protocol Length Info
    687 48.344690      10.70.1.234           10.70.1.20            MQTT     60     Publish Ack

Frame 687: 60 bytes on wire (480 bits), 60 bytes captured (480 bits) on interface 0
Ethernet II, Src: Wibrain_30:18:81 (00:1e:06:30:18:81), Dst: Giga-Byt_d1:2a:ce (90:2b:34:d1:2a:ce)
Internet Protocol Version 4, Src: 10.70.1.234, Dst: 10.70.1.20
Transmission Control Protocol, Src Port: 1883, Dst Port: 44882, Seq: 245, Ack: 1994, Len: 4
MQ Telemetry Transport Protocol, Publish Ack

No.     Time           Source                Destination           Protocol Length Info
    690 48.344795      10.70.1.20            10.70.1.234           MQTT     122    Publish Message, Publish Message

Frame 690: 122 bytes on wire (976 bits), 122 bytes captured (976 bits) on interface 0
Ethernet II, Src: Giga-Byt_d1:2a:ce (90:2b:34:d1:2a:ce), Dst: Wibrain_30:18:81 (00:1e:06:30:18:81)
Internet Protocol Version 4, Src: 10.70.1.20, Dst: 10.70.1.234
Transmission Control Protocol, Src Port: 44882, Dst Port: 1883, Seq: 1994, Ack: 249, Len: 68
MQ Telemetry Transport Protocol, Publish Message
MQ Telemetry Transport Protocol, Publish Message

No.     Time           Source                Destination           Protocol Length Info
    693 48.345648      10.70.1.234           10.70.1.20            MQTT     60     Publish Ack

Frame 693: 60 bytes on wire (480 bits), 60 bytes captured (480 bits) on interface 0
Ethernet II, Src: Wibrain_30:18:81 (00:1e:06:30:18:81), Dst: Giga-Byt_d1:2a:ce (90:2b:34:d1:2a:ce)
Internet Protocol Version 4, Src: 10.70.1.234, Dst: 10.70.1.20
Transmission Control Protocol, Src Port: 1883, Dst Port: 44882, Seq: 249, Ack: 2062, Len: 4
MQ Telemetry Transport Protocol, Publish Ack

No.     Time           Source                Destination           Protocol Length Info
    710 48.386254      10.70.1.234           10.70.1.20            MQTT     60     Publish Ack

Frame 710: 60 bytes on wire (480 bits), 60 bytes captured (480 bits) on interface 0
Ethernet II, Src: Wibrain_30:18:81 (00:1e:06:30:18:81), Dst: Giga-Byt_d1:2a:ce (90:2b:34:d1:2a:ce)
Internet Protocol Version 4, Src: 10.70.1.234, Dst: 10.70.1.20
Transmission Control Protocol, Src Port: 1883, Dst Port: 44882, Seq: 253, Ack: 2062, Len: 4
MQ Telemetry Transport Protocol, Publish Ack

No.     Time           Source                Destination           Protocol Length Info
    716 48.644640      10.70.1.20            10.70.1.234           MQTT     87     Publish Message

Frame 716: 87 bytes on wire (696 bits), 87 bytes captured (696 bits) on interface 0
Ethernet II, Src: Giga-Byt_d1:2a:ce (90:2b:34:d1:2a:ce), Dst: Wibrain_30:18:81 (00:1e:06:30:18:81)
Internet Protocol Version 4, Src: 10.70.1.20, Dst: 10.70.1.234
Transmission Control Protocol, Src Port: 44882, Dst Port: 1883, Seq: 2062, Ack: 257, Len: 33
MQ Telemetry Transport Protocol, Publish Message

No.     Time           Source                Destination           Protocol Length Info
    717 48.645440      10.70.1.234           10.70.1.20            MQTT     60     Publish Ack

Frame 717: 60 bytes on wire (480 bits), 60 bytes captured (480 bits) on interface 0
Ethernet II, Src: Wibrain_30:18:81 (00:1e:06:30:18:81), Dst: Giga-Byt_d1:2a:ce (90:2b:34:d1:2a:ce)
Internet Protocol Version 4, Src: 10.70.1.234, Dst: 10.70.1.20
Transmission Control Protocol, Src Port: 1883, Dst Port: 44882, Seq: 257, Ack: 2095, Len: 4
MQ Telemetry Transport Protocol, Publish Ack

No.     Time           Source                Destination           Protocol Length Info
    719 48.645518      10.70.1.20            10.70.1.234           MQTT     112    Publish Message, Publish Message

Frame 719: 112 bytes on wire (896 bits), 112 bytes captured (896 bits) on interface 0
Ethernet II, Src: Giga-Byt_d1:2a:ce (90:2b:34:d1:2a:ce), Dst: Wibrain_30:18:81 (00:1e:06:30:18:81)
Internet Protocol Version 4, Src: 10.70.1.20, Dst: 10.70.1.234
Transmission Control Protocol, Src Port: 44882, Dst Port: 1883, Seq: 2095, Ack: 261, Len: 58
MQ Telemetry Transport Protocol, Publish Message
MQ Telemetry Transport Protocol, Publish Message

No.     Time           Source                Destination           Protocol Length Info
    723 48.646276      10.70.1.234           10.70.1.20            MQTT     60     Publish Ack

Frame 723: 60 bytes on wire (480 bits), 60 bytes captured (480 bits) on interface 0
Ethernet II, Src: Wibrain_30:18:81 (00:1e:06:30:18:81), Dst: Giga-Byt_d1:2a:ce (90:2b:34:d1:2a:ce)
Internet Protocol Version 4, Src: 10.70.1.234, Dst: 10.70.1.20
Transmission Control Protocol, Src Port: 1883, Dst Port: 44882, Seq: 261, Ack: 2153, Len: 4
MQ Telemetry Transport Protocol, Publish Ack

No.     Time           Source                Destination           Protocol Length Info
    740 48.686866      10.70.1.234           10.70.1.20            MQTT     60     Publish Ack

Frame 740: 60 bytes on wire (480 bits), 60 bytes captured (480 bits) on interface 0
Ethernet II, Src: Wibrain_30:18:81 (00:1e:06:30:18:81), Dst: Giga-Byt_d1:2a:ce (90:2b:34:d1:2a:ce)
Internet Protocol Version 4, Src: 10.70.1.234, Dst: 10.70.1.20
Transmission Control Protocol, Src Port: 1883, Dst Port: 44882, Seq: 265, Ack: 2153, Len: 4
MQ Telemetry Transport Protocol, Publish Ack

No.     Time           Source                Destination           Protocol Length Info
   1084 50.146783      10.70.1.20            10.70.1.234           MQTT     87     Publish Message

Frame 1084: 87 bytes on wire (696 bits), 87 bytes captured (696 bits) on interface 0
Ethernet II, Src: Giga-Byt_d1:2a:ce (90:2b:34:d1:2a:ce), Dst: Wibrain_30:18:81 (00:1e:06:30:18:81)
Internet Protocol Version 4, Src: 10.70.1.20, Dst: 10.70.1.234
Transmission Control Protocol, Src Port: 44882, Dst Port: 1883, Seq: 2153, Ack: 269, Len: 33
MQ Telemetry Transport Protocol, Publish Message

No.     Time           Source                Destination           Protocol Length Info
   1085 50.147631      10.70.1.234           10.70.1.20            MQTT     60     Publish Ack

Frame 1085: 60 bytes on wire (480 bits), 60 bytes captured (480 bits) on interface 0
Ethernet II, Src: Wibrain_30:18:81 (00:1e:06:30:18:81), Dst: Giga-Byt_d1:2a:ce (90:2b:34:d1:2a:ce)
Internet Protocol Version 4, Src: 10.70.1.234, Dst: 10.70.1.20
Transmission Control Protocol, Src Port: 1883, Dst Port: 44882, Seq: 269, Ack: 2186, Len: 4
MQ Telemetry Transport Protocol, Publish Ack

No.     Time           Source                Destination           Protocol Length Info
   1086 50.147679      10.70.1.20            10.70.1.234           MQTT     122    Publish Message, Publish Message

Frame 1086: 122 bytes on wire (976 bits), 122 bytes captured (976 bits) on interface 0
Ethernet II, Src: Giga-Byt_d1:2a:ce (90:2b:34:d1:2a:ce), Dst: Wibrain_30:18:81 (00:1e:06:30:18:81)
Internet Protocol Version 4, Src: 10.70.1.20, Dst: 10.70.1.234
Transmission Control Protocol, Src Port: 44882, Dst Port: 1883, Seq: 2186, Ack: 273, Len: 68
MQ Telemetry Transport Protocol, Publish Message
MQ Telemetry Transport Protocol, Publish Message

No.     Time           Source                Destination           Protocol Length Info
   1092 50.148426      10.70.1.234           10.70.1.20            MQTT     60     Publish Ack

Frame 1092: 60 bytes on wire (480 bits), 60 bytes captured (480 bits) on interface 0
Ethernet II, Src: Wibrain_30:18:81 (00:1e:06:30:18:81), Dst: Giga-Byt_d1:2a:ce (90:2b:34:d1:2a:ce)
Internet Protocol Version 4, Src: 10.70.1.234, Dst: 10.70.1.20
Transmission Control Protocol, Src Port: 1883, Dst Port: 44882, Seq: 273, Ack: 2254, Len: 4
MQ Telemetry Transport Protocol, Publish Ack

No.     Time           Source                Destination           Protocol Length Info
   1109 50.189169      10.70.1.234           10.70.1.20            MQTT     60     Publish Ack

Frame 1109: 60 bytes on wire (480 bits), 60 bytes captured (480 bits) on interface 0
Ethernet II, Src: Wibrain_30:18:81 (00:1e:06:30:18:81), Dst: Giga-Byt_d1:2a:ce (90:2b:34:d1:2a:ce)
Internet Protocol Version 4, Src: 10.70.1.234, Dst: 10.70.1.20
Transmission Control Protocol, Src Port: 1883, Dst Port: 44882, Seq: 277, Ack: 2254, Len: 4
MQ Telemetry Transport Protocol, Publish Ack

No.     Time           Source                Destination           Protocol Length Info
   1156 50.447778      10.70.1.20            10.70.1.234           MQTT     87     Publish Message

Frame 1156: 87 bytes on wire (696 bits), 87 bytes captured (696 bits) on interface 0
Ethernet II, Src: Giga-Byt_d1:2a:ce (90:2b:34:d1:2a:ce), Dst: Wibrain_30:18:81 (00:1e:06:30:18:81)
Internet Protocol Version 4, Src: 10.70.1.20, Dst: 10.70.1.234
Transmission Control Protocol, Src Port: 44882, Dst Port: 1883, Seq: 2254, Ack: 281, Len: 33
MQ Telemetry Transport Protocol, Publish Message

No.     Time           Source                Destination           Protocol Length Info
   1158 50.448574      10.70.1.234           10.70.1.20            MQTT     60     Publish Ack

Frame 1158: 60 bytes on wire (480 bits), 60 bytes captured (480 bits) on interface 0
Ethernet II, Src: Wibrain_30:18:81 (00:1e:06:30:18:81), Dst: Giga-Byt_d1:2a:ce (90:2b:34:d1:2a:ce)
Internet Protocol Version 4, Src: 10.70.1.234, Dst: 10.70.1.20
Transmission Control Protocol, Src Port: 1883, Dst Port: 44882, Seq: 281, Ack: 2287, Len: 4
MQ Telemetry Transport Protocol, Publish Ack

No.     Time           Source                Destination           Protocol Length Info
   1194 50.548818      10.70.1.20            10.70.1.234           MQTT     88     Publish Message

Frame 1194: 88 bytes on wire (704 bits), 88 bytes captured (704 bits) on interface 0
Ethernet II, Src: Giga-Byt_d1:2a:ce (90:2b:34:d1:2a:ce), Dst: Wibrain_30:18:81 (00:1e:06:30:18:81)
Internet Protocol Version 4, Src: 10.70.1.20, Dst: 10.70.1.234
Transmission Control Protocol, Src Port: 44882, Dst Port: 1883, Seq: 2287, Ack: 285, Len: 34
MQ Telemetry Transport Protocol, Publish Message

No.     Time           Source                Destination           Protocol Length Info
   1197 50.549664      10.70.1.234           10.70.1.20            MQTT     60     Publish Ack

Frame 1197: 60 bytes on wire (480 bits), 60 bytes captured (480 bits) on interface 0
Ethernet II, Src: Wibrain_30:18:81 (00:1e:06:30:18:81), Dst: Giga-Byt_d1:2a:ce (90:2b:34:d1:2a:ce)
Internet Protocol Version 4, Src: 10.70.1.234, Dst: 10.70.1.20
Transmission Control Protocol, Src Port: 1883, Dst Port: 44882, Seq: 285, Ack: 2321, Len: 4
MQ Telemetry Transport Protocol, Publish Ack

No.     Time           Source                Destination           Protocol Length Info
   1199 50.549737      10.70.1.20            10.70.1.234           MQTT     78     Publish Message

Frame 1199: 78 bytes on wire (624 bits), 78 bytes captured (624 bits) on interface 0
Ethernet II, Src: Giga-Byt_d1:2a:ce (90:2b:34:d1:2a:ce), Dst: Wibrain_30:18:81 (00:1e:06:30:18:81)
Internet Protocol Version 4, Src: 10.70.1.20, Dst: 10.70.1.234
Transmission Control Protocol, Src Port: 44882, Dst Port: 1883, Seq: 2321, Ack: 289, Len: 24
MQ Telemetry Transport Protocol, Publish Message

No.     Time           Source                Destination           Protocol Length Info
   1204 50.550476      10.70.1.234           10.70.1.20            MQTT     60     Publish Ack

Frame 1204: 60 bytes on wire (480 bits), 60 bytes captured (480 bits) on interface 0
Ethernet II, Src: Wibrain_30:18:81 (00:1e:06:30:18:81), Dst: Giga-Byt_d1:2a:ce (90:2b:34:d1:2a:ce)
Internet Protocol Version 4, Src: 10.70.1.234, Dst: 10.70.1.20
Transmission Control Protocol, Src Port: 1883, Dst Port: 44882, Seq: 289, Ack: 2345, Len: 4
MQ Telemetry Transport Protocol, Publish Ack

No.     Time           Source                Destination           Protocol Length Info
   1236 52.050583      10.70.1.20            10.70.1.234           MQTT     87     Publish Message

Frame 1236: 87 bytes on wire (696 bits), 87 bytes captured (696 bits) on interface 0
Ethernet II, Src: Giga-Byt_d1:2a:ce (90:2b:34:d1:2a:ce), Dst: Wibrain_30:18:81 (00:1e:06:30:18:81)
Internet Protocol Version 4, Src: 10.70.1.20, Dst: 10.70.1.234
Transmission Control Protocol, Src Port: 44882, Dst Port: 1883, Seq: 2345, Ack: 293, Len: 33
MQ Telemetry Transport Protocol, Publish Message

No.     Time           Source                Destination           Protocol Length Info
   1237 52.051486      10.70.1.234           10.70.1.20            MQTT     60     Publish Ack

Frame 1237: 60 bytes on wire (480 bits), 60 bytes captured (480 bits) on interface 0
Ethernet II, Src: Wibrain_30:18:81 (00:1e:06:30:18:81), Dst: Giga-Byt_d1:2a:ce (90:2b:34:d1:2a:ce)
Internet Protocol Version 4, Src: 10.70.1.234, Dst: 10.70.1.20
Transmission Control Protocol, Src Port: 1883, Dst Port: 44882, Seq: 293, Ack: 2378, Len: 4
MQ Telemetry Transport Protocol, Publish Ack

No.     Time           Source                Destination           Protocol Length Info
   1239 52.051584      10.70.1.20            10.70.1.234           MQTT     122    Publish Message, Publish Message

Frame 1239: 122 bytes on wire (976 bits), 122 bytes captured (976 bits) on interface 0
Ethernet II, Src: Giga-Byt_d1:2a:ce (90:2b:34:d1:2a:ce), Dst: Wibrain_30:18:81 (00:1e:06:30:18:81)
Internet Protocol Version 4, Src: 10.70.1.20, Dst: 10.70.1.234
Transmission Control Protocol, Src Port: 44882, Dst Port: 1883, Seq: 2378, Ack: 297, Len: 68
MQ Telemetry Transport Protocol, Publish Message
MQ Telemetry Transport Protocol, Publish Message

No.     Time           Source                Destination           Protocol Length Info
   1243 52.052391      10.70.1.234           10.70.1.20            MQTT     60     Publish Ack

Frame 1243: 60 bytes on wire (480 bits), 60 bytes captured (480 bits) on interface 0
Ethernet II, Src: Wibrain_30:18:81 (00:1e:06:30:18:81), Dst: Giga-Byt_d1:2a:ce (90:2b:34:d1:2a:ce)
Internet Protocol Version 4, Src: 10.70.1.234, Dst: 10.70.1.20
Transmission Control Protocol, Src Port: 1883, Dst Port: 44882, Seq: 297, Ack: 2446, Len: 4
MQ Telemetry Transport Protocol, Publish Ack

No.     Time           Source                Destination           Protocol Length Info
   1259 52.093054      10.70.1.234           10.70.1.20            MQTT     60     Publish Ack

Frame 1259: 60 bytes on wire (480 bits), 60 bytes captured (480 bits) on interface 0
Ethernet II, Src: Wibrain_30:18:81 (00:1e:06:30:18:81), Dst: Giga-Byt_d1:2a:ce (90:2b:34:d1:2a:ce)
Internet Protocol Version 4, Src: 10.70.1.234, Dst: 10.70.1.20
Transmission Control Protocol, Src Port: 1883, Dst Port: 44882, Seq: 301, Ack: 2446, Len: 4
MQ Telemetry Transport Protocol, Publish Ack

No.     Time           Source                Destination           Protocol Length Info
   1262 52.650766      10.70.1.20            10.70.1.234           MQTT     87     Publish Message

Frame 1262: 87 bytes on wire (696 bits), 87 bytes captured (696 bits) on interface 0
Ethernet II, Src: Giga-Byt_d1:2a:ce (90:2b:34:d1:2a:ce), Dst: Wibrain_30:18:81 (00:1e:06:30:18:81)
Internet Protocol Version 4, Src: 10.70.1.20, Dst: 10.70.1.234
Transmission Control Protocol, Src Port: 44882, Dst Port: 1883, Seq: 2446, Ack: 305, Len: 33
MQ Telemetry Transport Protocol, Publish Message

No.     Time           Source                Destination           Protocol Length Info
   1263 52.651598      10.70.1.234           10.70.1.20            MQTT     60     Publish Ack

Frame 1263: 60 bytes on wire (480 bits), 60 bytes captured (480 bits) on interface 0
Ethernet II, Src: Wibrain_30:18:81 (00:1e:06:30:18:81), Dst: Giga-Byt_d1:2a:ce (90:2b:34:d1:2a:ce)
Internet Protocol Version 4, Src: 10.70.1.234, Dst: 10.70.1.20
Transmission Control Protocol, Src Port: 1883, Dst Port: 44882, Seq: 305, Ack: 2479, Len: 4
MQ Telemetry Transport Protocol, Publish Ack

No.     Time           Source                Destination           Protocol Length Info
   1265 52.651665      10.70.1.20            10.70.1.234           MQTT     112    Publish Message, Publish Message

Frame 1265: 112 bytes on wire (896 bits), 112 bytes captured (896 bits) on interface 0
Ethernet II, Src: Giga-Byt_d1:2a:ce (90:2b:34:d1:2a:ce), Dst: Wibrain_30:18:81 (00:1e:06:30:18:81)
Internet Protocol Version 4, Src: 10.70.1.20, Dst: 10.70.1.234
Transmission Control Protocol, Src Port: 44882, Dst Port: 1883, Seq: 2479, Ack: 309, Len: 58
MQ Telemetry Transport Protocol, Publish Message
MQ Telemetry Transport Protocol, Publish Message

No.     Time           Source                Destination           Protocol Length Info
   1273 52.652528      10.70.1.234           10.70.1.20            MQTT     60     Publish Ack

Frame 1273: 60 bytes on wire (480 bits), 60 bytes captured (480 bits) on interface 0
Ethernet II, Src: Wibrain_30:18:81 (00:1e:06:30:18:81), Dst: Giga-Byt_d1:2a:ce (90:2b:34:d1:2a:ce)
Internet Protocol Version 4, Src: 10.70.1.234, Dst: 10.70.1.20
Transmission Control Protocol, Src Port: 1883, Dst Port: 44882, Seq: 309, Ack: 2537, Len: 4
MQ Telemetry Transport Protocol, Publish Ack

No.     Time           Source                Destination           Protocol Length Info
   1289 52.693067      10.70.1.234           10.70.1.20            MQTT     60     Publish Ack

Frame 1289: 60 bytes on wire (480 bits), 60 bytes captured (480 bits) on interface 0
Ethernet II, Src: Wibrain_30:18:81 (00:1e:06:30:18:81), Dst: Giga-Byt_d1:2a:ce (90:2b:34:d1:2a:ce)
Internet Protocol Version 4, Src: 10.70.1.234, Dst: 10.70.1.20
Transmission Control Protocol, Src Port: 1883, Dst Port: 44882, Seq: 313, Ack: 2537, Len: 4
MQ Telemetry Transport Protocol, Publish Ack

No.     Time           Source                Destination           Protocol Length Info
   1293 54.151470      10.70.1.20            10.70.1.234           MQTT     87     Publish Message

Frame 1293: 87 bytes on wire (696 bits), 87 bytes captured (696 bits) on interface 0
Ethernet II, Src: Giga-Byt_d1:2a:ce (90:2b:34:d1:2a:ce), Dst: Wibrain_30:18:81 (00:1e:06:30:18:81)
Internet Protocol Version 4, Src: 10.70.1.20, Dst: 10.70.1.234
Transmission Control Protocol, Src Port: 44882, Dst Port: 1883, Seq: 2537, Ack: 317, Len: 33
MQ Telemetry Transport Protocol, Publish Message

No.     Time           Source                Destination           Protocol Length Info
   1295 54.152324      10.70.1.234           10.70.1.20            MQTT     60     Publish Ack

Frame 1295: 60 bytes on wire (480 bits), 60 bytes captured (480 bits) on interface 0
Ethernet II, Src: Wibrain_30:18:81 (00:1e:06:30:18:81), Dst: Giga-Byt_d1:2a:ce (90:2b:34:d1:2a:ce)
Internet Protocol Version 4, Src: 10.70.1.234, Dst: 10.70.1.20
Transmission Control Protocol, Src Port: 1883, Dst Port: 44882, Seq: 317, Ack: 2570, Len: 4
MQ Telemetry Transport Protocol, Publish Ack

No.     Time           Source                Destination           Protocol Length Info
   1296 54.152436      10.70.1.20            10.70.1.234           MQTT     88     Publish Message

Frame 1296: 88 bytes on wire (704 bits), 88 bytes captured (704 bits) on interface 0
Ethernet II, Src: Giga-Byt_d1:2a:ce (90:2b:34:d1:2a:ce), Dst: Wibrain_30:18:81 (00:1e:06:30:18:81)
Internet Protocol Version 4, Src: 10.70.1.20, Dst: 10.70.1.234
Transmission Control Protocol, Src Port: 44882, Dst Port: 1883, Seq: 2570, Ack: 321, Len: 34
MQ Telemetry Transport Protocol, Publish Message

No.     Time           Source                Destination           Protocol Length Info
   1300 54.153303      10.70.1.234           10.70.1.20            MQTT     60     Publish Ack

Frame 1300: 60 bytes on wire (480 bits), 60 bytes captured (480 bits) on interface 0
Ethernet II, Src: Wibrain_30:18:81 (00:1e:06:30:18:81), Dst: Giga-Byt_d1:2a:ce (90:2b:34:d1:2a:ce)
Internet Protocol Version 4, Src: 10.70.1.234, Dst: 10.70.1.20
Transmission Control Protocol, Src Port: 1883, Dst Port: 44882, Seq: 321, Ack: 2604, Len: 4
MQ Telemetry Transport Protocol, Publish Ack

No.     Time           Source                Destination           Protocol Length Info
   1312 54.249667      10.70.1.20            10.70.1.234           MQTT     88     Publish Message

Frame 1312: 88 bytes on wire (704 bits), 88 bytes captured (704 bits) on interface 0
Ethernet II, Src: Giga-Byt_d1:2a:ce (90:2b:34:d1:2a:ce), Dst: Wibrain_30:18:81 (00:1e:06:30:18:81)
Internet Protocol Version 4, Src: 10.70.1.20, Dst: 10.70.1.234
Transmission Control Protocol, Src Port: 44882, Dst Port: 1883, Seq: 2604, Ack: 325, Len: 34
MQ Telemetry Transport Protocol, Publish Message

No.     Time           Source                Destination           Protocol Length Info
   1313 54.250548      10.70.1.234           10.70.1.20            MQTT     60     Publish Ack

Frame 1313: 60 bytes on wire (480 bits), 60 bytes captured (480 bits) on interface 0
Ethernet II, Src: Wibrain_30:18:81 (00:1e:06:30:18:81), Dst: Giga-Byt_d1:2a:ce (90:2b:34:d1:2a:ce)
Internet Protocol Version 4, Src: 10.70.1.234, Dst: 10.70.1.20
Transmission Control Protocol, Src Port: 1883, Dst Port: 44882, Seq: 325, Ack: 2638, Len: 4
MQ Telemetry Transport Protocol, Publish Ack

No.     Time           Source                Destination           Protocol Length Info
   1322 54.550391      10.70.1.20            10.70.1.234           MQTT     87     Publish Message

Frame 1322: 87 bytes on wire (696 bits), 87 bytes captured (696 bits) on interface 0
Ethernet II, Src: Giga-Byt_d1:2a:ce (90:2b:34:d1:2a:ce), Dst: Wibrain_30:18:81 (00:1e:06:30:18:81)
Internet Protocol Version 4, Src: 10.70.1.20, Dst: 10.70.1.234
Transmission Control Protocol, Src Port: 44882, Dst Port: 1883, Seq: 2638, Ack: 329, Len: 33
MQ Telemetry Transport Protocol, Publish Message

No.     Time           Source                Destination           Protocol Length Info
   1323 54.551270      10.70.1.234           10.70.1.20            MQTT     60     Publish Ack

Frame 1323: 60 bytes on wire (480 bits), 60 bytes captured (480 bits) on interface 0
Ethernet II, Src: Wibrain_30:18:81 (00:1e:06:30:18:81), Dst: Giga-Byt_d1:2a:ce (90:2b:34:d1:2a:ce)
Internet Protocol Version 4, Src: 10.70.1.234, Dst: 10.70.1.20
Transmission Control Protocol, Src Port: 1883, Dst Port: 44882, Seq: 329, Ack: 2671, Len: 4
MQ Telemetry Transport Protocol, Publish Ack

No.     Time           Source                Destination           Protocol Length Info
   1325 54.551348      10.70.1.20            10.70.1.234           MQTT     112    Publish Message, Publish Message

Frame 1325: 112 bytes on wire (896 bits), 112 bytes captured (896 bits) on interface 0
Ethernet II, Src: Giga-Byt_d1:2a:ce (90:2b:34:d1:2a:ce), Dst: Wibrain_30:18:81 (00:1e:06:30:18:81)
Internet Protocol Version 4, Src: 10.70.1.20, Dst: 10.70.1.234
Transmission Control Protocol, Src Port: 44882, Dst Port: 1883, Seq: 2671, Ack: 333, Len: 58
MQ Telemetry Transport Protocol, Publish Message
MQ Telemetry Transport Protocol, Publish Message

No.     Time           Source                Destination           Protocol Length Info
   1329 54.552142      10.70.1.234           10.70.1.20            MQTT     60     Publish Ack

Frame 1329: 60 bytes on wire (480 bits), 60 bytes captured (480 bits) on interface 0
Ethernet II, Src: Wibrain_30:18:81 (00:1e:06:30:18:81), Dst: Giga-Byt_d1:2a:ce (90:2b:34:d1:2a:ce)
Internet Protocol Version 4, Src: 10.70.1.234, Dst: 10.70.1.20
Transmission Control Protocol, Src Port: 1883, Dst Port: 44882, Seq: 333, Ack: 2729, Len: 4
MQ Telemetry Transport Protocol, Publish Ack

No.     Time           Source                Destination           Protocol Length Info
   1346 54.593174      10.70.1.234           10.70.1.20            MQTT     60     Publish Ack

Frame 1346: 60 bytes on wire (480 bits), 60 bytes captured (480 bits) on interface 0
Ethernet II, Src: Wibrain_30:18:81 (00:1e:06:30:18:81), Dst: Giga-Byt_d1:2a:ce (90:2b:34:d1:2a:ce)
Internet Protocol Version 4, Src: 10.70.1.234, Dst: 10.70.1.20
Transmission Control Protocol, Src Port: 1883, Dst Port: 44882, Seq: 337, Ack: 2729, Len: 4
MQ Telemetry Transport Protocol, Publish Ack

No.     Time           Source                Destination           Protocol Length Info
   1373 56.051825      10.70.1.20            10.70.1.234           MQTT     87     Publish Message

Frame 1373: 87 bytes on wire (696 bits), 87 bytes captured (696 bits) on interface 0
Ethernet II, Src: Giga-Byt_d1:2a:ce (90:2b:34:d1:2a:ce), Dst: Wibrain_30:18:81 (00:1e:06:30:18:81)
Internet Protocol Version 4, Src: 10.70.1.20, Dst: 10.70.1.234
Transmission Control Protocol, Src Port: 44882, Dst Port: 1883, Seq: 2729, Ack: 341, Len: 33
MQ Telemetry Transport Protocol, Publish Message

No.     Time           Source                Destination           Protocol Length Info
   1374 56.052730      10.70.1.234           10.70.1.20            MQTT     60     Publish Ack

Frame 1374: 60 bytes on wire (480 bits), 60 bytes captured (480 bits) on interface 0
Ethernet II, Src: Wibrain_30:18:81 (00:1e:06:30:18:81), Dst: Giga-Byt_d1:2a:ce (90:2b:34:d1:2a:ce)
Internet Protocol Version 4, Src: 10.70.1.234, Dst: 10.70.1.20
Transmission Control Protocol, Src Port: 1883, Dst Port: 44882, Seq: 341, Ack: 2762, Len: 4
MQ Telemetry Transport Protocol, Publish Ack

No.     Time           Source                Destination           Protocol Length Info
   1376 56.052812      10.70.1.20            10.70.1.234           MQTT     122    Publish Message, Publish Message

Frame 1376: 122 bytes on wire (976 bits), 122 bytes captured (976 bits) on interface 0
Ethernet II, Src: Giga-Byt_d1:2a:ce (90:2b:34:d1:2a:ce), Dst: Wibrain_30:18:81 (00:1e:06:30:18:81)
Internet Protocol Version 4, Src: 10.70.1.20, Dst: 10.70.1.234
Transmission Control Protocol, Src Port: 44882, Dst Port: 1883, Seq: 2762, Ack: 345, Len: 68
MQ Telemetry Transport Protocol, Publish Message
MQ Telemetry Transport Protocol, Publish Message

No.     Time           Source                Destination           Protocol Length Info
   1380 56.053620      10.70.1.234           10.70.1.20            MQTT     60     Publish Ack

Frame 1380: 60 bytes on wire (480 bits), 60 bytes captured (480 bits) on interface 0
Ethernet II, Src: Wibrain_30:18:81 (00:1e:06:30:18:81), Dst: Giga-Byt_d1:2a:ce (90:2b:34:d1:2a:ce)
Internet Protocol Version 4, Src: 10.70.1.234, Dst: 10.70.1.20
Transmission Control Protocol, Src Port: 1883, Dst Port: 44882, Seq: 345, Ack: 2830, Len: 4
MQ Telemetry Transport Protocol, Publish Ack

No.     Time           Source                Destination           Protocol Length Info
   1396 56.094210      10.70.1.234           10.70.1.20            MQTT     60     Publish Ack

Frame 1396: 60 bytes on wire (480 bits), 60 bytes captured (480 bits) on interface 0
Ethernet II, Src: Wibrain_30:18:81 (00:1e:06:30:18:81), Dst: Giga-Byt_d1:2a:ce (90:2b:34:d1:2a:ce)
Internet Protocol Version 4, Src: 10.70.1.234, Dst: 10.70.1.20
Transmission Control Protocol, Src Port: 1883, Dst Port: 44882, Seq: 349, Ack: 2830, Len: 4
MQ Telemetry Transport Protocol, Publish Ack

No.     Time           Source                Destination           Protocol Length Info
   1400 56.652013      10.70.1.20            10.70.1.234           MQTT     87     Publish Message

Frame 1400: 87 bytes on wire (696 bits), 87 bytes captured (696 bits) on interface 0
Ethernet II, Src: Giga-Byt_d1:2a:ce (90:2b:34:d1:2a:ce), Dst: Wibrain_30:18:81 (00:1e:06:30:18:81)
Internet Protocol Version 4, Src: 10.70.1.20, Dst: 10.70.1.234
Transmission Control Protocol, Src Port: 44882, Dst Port: 1883, Seq: 2830, Ack: 353, Len: 33
MQ Telemetry Transport Protocol, Publish Message

No.     Time           Source                Destination           Protocol Length Info
   1402 56.652866      10.70.1.234           10.70.1.20            MQTT     60     Publish Ack

Frame 1402: 60 bytes on wire (480 bits), 60 bytes captured (480 bits) on interface 0
Ethernet II, Src: Wibrain_30:18:81 (00:1e:06:30:18:81), Dst: Giga-Byt_d1:2a:ce (90:2b:34:d1:2a:ce)
Internet Protocol Version 4, Src: 10.70.1.234, Dst: 10.70.1.20
Transmission Control Protocol, Src Port: 1883, Dst Port: 44882, Seq: 353, Ack: 2863, Len: 4
MQ Telemetry Transport Protocol, Publish Ack

No.     Time           Source                Destination           Protocol Length Info
   1403 56.652953      10.70.1.20            10.70.1.234           MQTT     112    Publish Message, Publish Message

Frame 1403: 112 bytes on wire (896 bits), 112 bytes captured (896 bits) on interface 0
Ethernet II, Src: Giga-Byt_d1:2a:ce (90:2b:34:d1:2a:ce), Dst: Wibrain_30:18:81 (00:1e:06:30:18:81)
Internet Protocol Version 4, Src: 10.70.1.20, Dst: 10.70.1.234
Transmission Control Protocol, Src Port: 44882, Dst Port: 1883, Seq: 2863, Ack: 357, Len: 58
MQ Telemetry Transport Protocol, Publish Message
MQ Telemetry Transport Protocol, Publish Message

No.     Time           Source                Destination           Protocol Length Info
   1407 56.653825      10.70.1.234           10.70.1.20            MQTT     60     Publish Ack

Frame 1407: 60 bytes on wire (480 bits), 60 bytes captured (480 bits) on interface 0
Ethernet II, Src: Wibrain_30:18:81 (00:1e:06:30:18:81), Dst: Giga-Byt_d1:2a:ce (90:2b:34:d1:2a:ce)
Internet Protocol Version 4, Src: 10.70.1.234, Dst: 10.70.1.20
Transmission Control Protocol, Src Port: 1883, Dst Port: 44882, Seq: 357, Ack: 2921, Len: 4
MQ Telemetry Transport Protocol, Publish Ack

No.     Time           Source                Destination           Protocol Length Info
   1423 56.694591      10.70.1.234           10.70.1.20            MQTT     60     Publish Ack

Frame 1423: 60 bytes on wire (480 bits), 60 bytes captured (480 bits) on interface 0
Ethernet II, Src: Wibrain_30:18:81 (00:1e:06:30:18:81), Dst: Giga-Byt_d1:2a:ce (90:2b:34:d1:2a:ce)
Internet Protocol Version 4, Src: 10.70.1.234, Dst: 10.70.1.20
Transmission Control Protocol, Src Port: 1883, Dst Port: 44882, Seq: 361, Ack: 2921, Len: 4
MQ Telemetry Transport Protocol, Publish Ack
